country_iso3,country_name,year,value,unit,variant_code,variant_label,source_dataset,original_period_label,notes
IRN,Iran,2016,29645,rials/USD,foreign_exchange_average_exchange_rate_official_iranian_rials_per_us,"Foreign exchange — Average exchange rate, official (Iranian rials per US$)",imf-article-iv-iran-2018,2015/16,"Table 2 memorandum item. [unit 'rials/USD' is an exchange rate, not a monetary value -- not converted] [cite: IMF Country Report No. 18/93, ""Islamic Republic of Iran: 2018 Article IV Consultation"", March 2018, printed p.30]"
IRN,Iran,2017,31457,rials/USD,foreign_exchange_average_exchange_rate_official_iranian_rials_per_us,"Foreign exchange — Average exchange rate, official (Iranian rials per US$)",imf-article-iv-iran-2018,2016/17,"Table 2 memorandum item. [unit 'rials/USD' is an exchange rate, not a monetary value -- not converted] [cite: IMF Country Report No. 18/93, ""Islamic Republic of Iran: 2018 Article IV Consultation"", March 2018, printed p.30]"
IRN,Iran,2016,34359,rials/USD,foreign_exchange_average_exchange_rate_market_iranian_rials_per_us,"Foreign exchange — Average exchange rate, market (Iranian rials per US$)",imf-article-iv-iran-2018,2015/16,"Table 2 memorandum item -- shows the gap between official and market exchange rates. [unit 'rials/USD' is an exchange rate, not a monetary value -- not converted] [cite: IMF Country Report No. 18/93, ""Islamic Republic of Iran: 2018 Article IV Consultation"", March 2018, printed p.30]"
IRN,Iran,2017,36328,rials/USD,foreign_exchange_average_exchange_rate_market_iranian_rials_per_us,"Foreign exchange — Average exchange rate, market (Iranian rials per US$)",imf-article-iv-iran-2018,2016/17,"Table 2 memorandum item -- shows the gap between official and market exchange rates. [unit 'rials/USD' is an exchange rate, not a monetary value -- not converted] [cite: IMF Country Report No. 18/93, ""Islamic Republic of Iran: 2018 Article IV Consultation"", March 2018, printed p.30]"
IRN,Iran,2018,under 20,percent,foreign_exchange_spread_between_official_and_market_exchange_rate_after_feb_2018_interest_rate_increase,"Foreign exchange — Spread between official and market exchange rate, after Feb 2018 interest rate increase",imf-article-iv-iran-2018,early 2018,"Narrowed from a wider spread following the increase in interest rates in February 2018. [cite: IMF Country Report No. 18/93, ""Islamic Republic of Iran: 2018 Article IV Consultation"", March 2018, printed p.1]"
