chart_id,action,n_variants_before,keep_variant_codes,drop_reason,split_into,notes
iran_provincial__industry_workshops_1396_1400,split,64,industrial_production_value_share_pct_آذربايجان_شرقي|industrial_production_value_share_pct_آذربايجان_غربي|industrial_production_value_share_pct_اردبيل|industrial_production_value_share_pct_اصفهان|industrial_production_value_share_pct_البرز|industrial_production_value_share_pct_ايلام|industrial_production_value_share_pct_بوشهر|industrial_production_value_share_pct_تهران|industrial_production_value_share_pct_خراسان_جنوبي|industrial_production_value_share_pct_خراسان_رضوي|industrial_production_value_share_pct_خراسان_شمالي|industrial_production_value_share_pct_خوزستان|industrial_production_value_share_pct_زنجان|industrial_production_value_share_pct_سمنان|industrial_production_value_share_pct_سيستان_و_بلوچستان|industrial_production_value_share_pct_فارس|industrial_production_value_share_pct_قزوين|industrial_production_value_share_pct_قم|industrial_production_value_share_pct_كردستان|industrial_production_value_share_pct_كرمان|industrial_production_value_share_pct_كرمانشاه|industrial_production_value_share_pct_كهگيلويه_و_بوير_احمد|industrial_production_value_share_pct_لرستان|industrial_production_value_share_pct_مازندران|industrial_production_value_share_pct_مركزي|industrial_production_value_share_pct_هرمزگان|industrial_production_value_share_pct_همدان|industrial_production_value_share_pct_يزد|industrial_production_value_share_pct_چهار_محال_و_بختياري|industrial_production_value_share_pct_کل_كشور|industrial_production_value_share_pct_گلستان|industrial_production_value_share_pct_گيلان|industrial_workshop_count_share_pct_آذربايجان_شرقي|industrial_workshop_count_share_pct_آذربايجان_غربي|industrial_workshop_count_share_pct_اردبيل|industrial_workshop_count_share_pct_اصفهان|industrial_workshop_count_share_pct_البرز|industrial_workshop_count_share_pct_ايلام|industrial_workshop_count_share_pct_بوشهر|industrial_workshop_count_share_pct_تهران|industrial_workshop_count_share_pct_خراسان_جنوبي|industrial_workshop_count_share_pct_خراسان_رضوي|industrial_workshop_count_share_pct_خراسان_شمالي|industrial_workshop_count_share_pct_خوزستان|industrial_workshop_count_share_pct_زنجان|industrial_workshop_count_share_pct_سمنان|industrial_workshop_count_share_pct_سيستان_و_بلوچستان|industrial_workshop_count_share_pct_فارس|industrial_workshop_count_share_pct_قزوين|industrial_workshop_count_share_pct_قم|industrial_workshop_count_share_pct_كردستان|industrial_workshop_count_share_pct_كرمان|industrial_workshop_count_share_pct_كرمانشاه|industrial_workshop_count_share_pct_كهگيلويه_و_بوير_احمد|industrial_workshop_count_share_pct_لرستان|industrial_workshop_count_share_pct_مازندران|industrial_workshop_count_share_pct_مركزي|industrial_workshop_count_share_pct_هرمزگان|industrial_workshop_count_share_pct_همدان|industrial_workshop_count_share_pct_يزد|industrial_workshop_count_share_pct_چهار_محال_و_بختياري|industrial_workshop_count_share_pct_کل_كشور|industrial_workshop_count_share_pct_گلستان|industrial_workshop_count_share_pct_گيلان,No variants dropped -- province is the informative dimension. Just regrouped into 2 single-measure charts.,Industrial Production Value Share by Province (SH1396-1400) [32 variants: industrial_production_value_share_pct_*] | Industrial Workshop Count Share by Province (SH1396-1400) [32 variants: industrial_workshop_count_share_pct_*],"Two measures (production value share vs. workshop count share, both for 10+-employee workshops) x ~32 provinces jammed into one chart. Split by measure, keep full province breakdown in each."
iran_provincial__mining_production_value_1397_1401,keep,32,mine_production_value_share_pct_آذربايجان_شرقی|mine_production_value_share_pct_آذربايجان_غربي|mine_production_value_share_pct_اردبيل|mine_production_value_share_pct_اصفهان|mine_production_value_share_pct_البرز|mine_production_value_share_pct_ايلام|mine_production_value_share_pct_بوشهر|mine_production_value_share_pct_تهران|mine_production_value_share_pct_خراسان_جنوبي|mine_production_value_share_pct_خراسان_رضوي|mine_production_value_share_pct_خراسان_شمالي|mine_production_value_share_pct_خوزستان|mine_production_value_share_pct_زنجان|mine_production_value_share_pct_سمنان|mine_production_value_share_pct_سيستان_و_بلوچستان|mine_production_value_share_pct_فارس|mine_production_value_share_pct_قزوين|mine_production_value_share_pct_قم|mine_production_value_share_pct_كردستان|mine_production_value_share_pct_كرمان|mine_production_value_share_pct_كرمانشاه|mine_production_value_share_pct_كهگيلويه_و_بوير_احمد|mine_production_value_share_pct_لرستان|mine_production_value_share_pct_مازندران|mine_production_value_share_pct_مركزي|mine_production_value_share_pct_هرمزگان|mine_production_value_share_pct_همدان|mine_production_value_share_pct_يزد|mine_production_value_share_pct_چهار_محال_و_بختياري|mine_production_value_share_pct_کل_کشور|mine_production_value_share_pct_گلستان|mine_production_value_share_pct_گيلان,,,"Single measure (mine production value share), one variant per province -- province is the point of the chart. Keep all."
iran_sci1399__cpi_by_coicop_group_1390_1399,trim,114,general_index_cpi_index_1395_100|food_and_beverages_cpi_index_1395_100|tobacco_cpi_index_1395_100|clothing_and_footwear_cpi_index_1395_100|housing_water_electricity_gas_and_other_fuels_cpi_index_1395_100|household_furnishings_and_appliances_and_their_repair_and_maintenance_cpi_index_1395_100|health_medical_care_cpi_index_1395_100|transportation_cpi_index_1395_100|communication_cpi_index_1395_100|recreation_and_culture_cpi_index_1395_100|education_cpi_index_1395_100|hotels_and_restaurants_cpi_index_1395_100|miscellaneous_goods_and_services_cpi_index_1395_100,"Dropped ~100 nested COICOP sub-groups (e.g. bread_and_cereals, meat_and_poultry, fish_and_sea_food under food_and_beverages), plus the weight_pct_of_1395_basket variants (static basket weights, not a time series) and pct_change_1399_vs_1398 variants (single-year snapshot, not a time series).",,"Exactly the brief's example: kept the general index plus the 12 top-level COICOP-equivalent divisions (food & beverages, tobacco, clothing & footwear, housing & utilities, furnishings, health, transport, communication, recreation & culture, education, hotels & restaurants, misc.), each with its real 6-year cpi_index series. 13 variants total."
iran_sci1399__gdp_by_expenditure_component_1390_1397,trim,53,private_final_consumption_expenditures_current_prices|private_final_consumption_expenditures_constant_1390_prices|government_final_consumption_expenditure_current_prices|government_final_consumption_expenditure_constant_1390_prices|gross_fixed_capital_formation_current_prices|gross_fixed_capital_formation_constant_1390_prices|net_exports_of_goods_and_services_current_prices|net_exports_of_goods_and_services_constant_1390_prices|change_in_stocks_and_statistical_discrepancies_current_prices|change_in_stocks_and_statistical_discrepancies_constant_1390_prices|gross_domestic_product_at_market_prices_current_prices|gross_domestic_product_at_market_prices_constant_1390_prices,"Dropped GFCF asset-type sub-splits (machinery/construction each by public vs private sector, cultivated assets, mineral exploration, software, literary/artistic originals), the household-vs-NPISHs split of private consumption, exports/imports shown separately (kept net), and secondary income-account aggregates (GNP, national income, net income from abroad, consumption of fixed capital).",,"Kept the 6 standard national-accounts expenditure components (private consumption, government consumption, GFCF, net exports, stock changes, GDP) x current/constant prices -- the current-vs-constant doubling mirrors this project's existing nominal/real convention, not a measure explosion, so both bases were kept. 12 variants total."
iran_sci1399__gdp_value_added_by_sector_1390_1397,trim,55,accommodation_and_food_service_activities_current_prices|accommodation_and_food_service_activities_constant_1390_prices|administration_and_support_service_activities_current_prices|administration_and_support_service_activities_constant_1390_prices|agriculture_hunting_forestry_and_fishing_current_prices|agriculture_hunting_forestry_and_fishing_constant_1390_prices|construction_current_prices|construction_constant_1390_prices|education_current_prices|education_constant_1390_prices|electricity_gas_steam_and_air_conditioning_supply_current_prices|electricity_gas_steam_and_air_conditioning_supply_constant_1390_prices|financial_and_insurance_services_current_prices|financial_and_insurance_services_constant_1390_prices|human_health_and_social_work_activities_current_prices|human_health_and_social_work_activities_constant_1390_prices|information_and_communication_current_prices|information_and_communication_constant_1390_prices|manufacturing_current_prices|manufacturing_constant_1390_prices|mining_and_quarrying_current_prices|mining_and_quarrying_constant_1390_prices|other_community_social_personal_and_household_service_activities_current_prices|other_community_social_personal_and_household_service_activities_constant_1390_prices|professional_scientific_and_technical_service_activities_current_prices|professional_scientific_and_technical_service_activities_constant_1390_prices|public_administration_and_urban_services_current_prices|public_administration_and_urban_services_constant_1390_prices|real_estate_activities_current_prices|real_estate_activities_constant_1390_prices|transport_storage_and_post_current_prices|transport_storage_and_post_constant_1390_prices|water_supply_sewerage_waste_management_and_remediation_activities_current_prices|water_supply_sewerage_waste_management_and_remediation_activities_constant_1390_prices|wholesale_retail_trade_repair_of_motor_vehicles_and_goods_current_prices|wholesale_retail_trade_repair_of_motor_vehicles_and_goods_constant_1390_prices|total_value_added_current_prices|total_value_added_constant_1390_prices,"Dropped 8 macro income-account identities that do not belong on a ""value added by sector"" table (gross_domestic_product_at_market_prices, gross_national_product, national_income, net_income_from_abroad, net_taxes_on_imports, taxes_on_imports, subsidies_on_imports, less_consumption_of_fixed_capital, from_changes_in_the_terms_of_trade) -- these appear to be copy-pasted from the sibling GDP-by-expenditure chart's structure and are out of scope here.",,"Sector breakdown IS the point of this chart (title: ""18 Economic-Activity Sectors""), so all 18 ISIC-style sectors were kept x current/constant prices (mirrors the project's nominal/real convention), plus total_value_added as the headline check-total. 38 variants -- above the usual <=12 guideline, but justified because the sector dimension is the explicit subject, not an artificial cross-tab."
iran_sci1399__government_budget_summary_1385_1400,trim,28,total_budget_resources|government_general_budget_resources|government_special_resources|resources_of_public_corporations_banks_and_government_affiliated_for_profit_institutions|less_duplications_resources_side|total_country_budget_uses|government_general_budget_uses|government_special_uses|uses_of_public_corporations_banks_and_government_affiliated_for_profit_enterprises|less_duplications_uses_side,"Dropped 3rd-level sub-items on both sides: resources side (disposal_of_non_financial_assets, disposal_of_financial_assets, special_revenues, public_corporations/banks/government-affiliated-institution resource sub-splits) and uses side (expenditures_current, acquisition_of_non/financial_assets, expenses/capital special-use sub-splits, from_government_special_revenues, public_corporations/banks/enterprise use sub-splits), plus near-duplicate labels like government_general_resources/government_general_revenues that shadow government_general_budget_resources.",,"Kept as ONE chart (not split) since resources and uses of a government budget are conventionally shown together as a balanced statement, matching the existing title ""Total Country Budget: Resources & Uses Breakdown"". Kept the top-level total plus the 3 major sub-categories (general/special/public-corporations) and the duplication adjustment on each side -- 10 of 28 variants, all with a real 8-point time series (2006-2021)."
iran_sci1399__labor_force_indicators_1380_1399,trim,72,national_both_economic_participation_rate_pct|national_male_economic_participation_rate_pct|national_female_economic_participation_rate_pct|national_both_unemployment_rate_pct|national_male_unemployment_rate_pct|national_female_unemployment_rate_pct|national_both_unemployment_rate_15_24_pct|national_male_unemployment_rate_15_24_pct|national_female_unemployment_rate_15_24_pct|national_both_underemployment_share_pct|national_male_underemployment_share_pct|national_female_underemployment_share_pct,"Dropped the urban/rural area breakdown entirely (collapsed to national), dropped sectoral employment-share indicators (agriculture/manufacturing/services) and the redundant unemployment_rate_15_29 age band -- a (national/urban/rural) x (both/male/female) x (8 indicators) = 72-cell cross-tab.",,"Exactly the brief's cited example. Sex breakdown is genuinely the point (male vs. female labor-market gap is the headline story) so it was kept per the ""sex is the point"" exception; urban/rural was collapsed since it is a secondary cross-tab. Kept 4 headline indicators (participation, overall unemployment, youth unemployment, underemployment) x 3 sex categories = 12 variants."
iran_telecom__radio_tv_ownership_1940_1989,hide,16,,,,"Grab-bag of 16 disparate one-off radio/TV milestones (station founding dates, 1974 audience-reach survey cells, 1978 coverage projections, 1988/89 channel counts); 14 of 16 variants are single-year (n=1) facts. Only 2 variants have 2 sparse points a decade+ apart, not a real trend. No measure here is genuinely tracked over time -- propose hiding the whole chart."
pahlavi__consortium_disbursements_1954_62,trim,17,grand_total|payments_to_iranian_government_under_oil_agreement_subtotal|income_tax_subtotal|other_payments_consortium_estimate_total|other_payments_consortium_estimate_wages_and_salaries|consortium_disbursements_as_of_gnp,"Dropped the cash-vs-petroleum-products split of oil-agreement payments, the trading-vs-operating-company split of income tax, 4 of 5 ""other payments"" sub-items (import duties, social-insurance contributions, payments to Iranian contractors, catch-all ""other""), 2 of 3 ratio metrics, and the redundant cross-check total.",,"Kept the grand total plus the 3 major subtotals (oil-agreement payments, income tax, other payments) and explicitly kept the wages-and-salaries line since the chart title itself calls out ""incl. Aggregate Oil-Sector Wage Bill"". Added consortium_disbursements_as_of_gnp as one normalized headline ratio for context. 6 of 17 variants, all real 1954-1962 annual series."
pahlavi__electric_power_generation_by_use_1968_72,trim,68,electric_power_generation_by_use_grand_total_total|electric_power_generation_by_use_total_of_industrial_plants_total|electric_power_generation_by_use_total_of_power_agencies_agricultural|electric_power_generation_by_use_total_of_power_agencies_domestic|electric_power_generation_by_use_total_of_power_agencies_industrial|electric_power_generation_by_use_total_of_power_agencies_public_commercial_other|electric_power_generation_by_use_total_of_power_agencies_street_lighting|electric_power_generation_by_use_total_of_power_agencies_total,"Dropped the 11 regional-electric-company x 6 end-use cross-tab (66 of 68 variants) -- the chart title's point is END-USE (""by End-Use, incl. Residential""), not the regional utility company.",,"The source table already provides a national ""total_of_power_agencies"" rollup by end-use (agricultural/domestic/industrial/public&commercial/street-lighting/total) plus a grand total and industrial-plants total -- exactly the national end-use breakdown the title promises. Kept those 8, dropped all 11 regional-company rows."
pahlavi__exports_by_commodity_value_1956_59,trim,30,raw_cotton_export_value|carpets_export_value|fruits_export_value|wool_export_value|hides_and_skins_export_value|rice_export_value|gums_export_value|hair_export_value|animal_casings_export_value|minerals_export_value|cumin_seeds_export_value|oilseeds_export_value|timber_export_value|other_export_value|total_export_value,"Dropped the 15 share_of_total_exports variants (a derived %, computable from value/total, doubling the variant count without adding new information).",,"Commodity is the point of a ""by Commodity"" chart, so all 14 commodities plus the total were kept (15 variants) using the value series only; the parallel %-share series were dropped as redundant."
pahlavi__imports_by_commodity_value_1956_59,trim,40,automotive_and_spare_parts_import_value|chemicals_and_drugs_import_value|cotton_textiles_import_value|dyes_import_value|edible_oils_and_fats_import_value|glassware_import_value|hats_umbrellas_and_shoes_import_value|iron_and_steel_import_value|leather_goods_import_value|lubricants_import_value|machinery_import_value|other_import_value|paper_products_import_value|radios_import_value|silk_textiles_import_value|sugar_import_value|tea_import_value|tires_and_tubes_import_value|total_import_value|woolen_textiles_import_value,"Dropped the 20 share_of_total_imports variants (a derived %, computable from value/total).",,"Same pattern as the sibling exports chart: commodity is the point, kept all 19 commodities plus total using the value series (20 variants), dropped the redundant %-share series."
pahlavi__monetary_aggregates_movements_1963_73,trim,39,domestic_assets_net|domestic_assets_net.USD_NOMINAL|domestic_assets_net.USD_REAL_2015|domestic_assets_net_claims_on_private_sector|domestic_assets_net_claims_on_private_sector.USD_NOMINAL|domestic_assets_net_claims_on_private_sector.USD_REAL_2015|domestic_assets_net_claims_on_public_sector_net|domestic_assets_net_claims_on_public_sector_net.USD_NOMINAL|domestic_assets_net_claims_on_public_sector_net.USD_REAL_2015|foreign_assets_net|foreign_assets_net.USD_NOMINAL|foreign_assets_net.USD_REAL_2015|money_and_quasi_money|money_and_quasi_money.USD_NOMINAL|money_and_quasi_money.USD_REAL_2015|money_and_quasi_money_money|money_and_quasi_money_money.USD_NOMINAL|money_and_quasi_money_money.USD_REAL_2015|money_and_quasi_money_quasi_money|money_and_quasi_money_quasi_money.USD_NOMINAL|money_and_quasi_money_quasi_money.USD_REAL_2015|other_items_net_increase|other_items_net_increase.USD_NOMINAL|other_items_net_increase.USD_REAL_2015,"Dropped the 3rd-level hierarchy sub-splits: domestic_assets_net_national_government_net and domestic_assets_net_official_entities_net (children of claims_on_public_sector_net), and the 3 other_items_net_increase sub-items (capital_accounts, import_deposits, other_items).",,The .USD_NOMINAL/.USD_REAL_2015 suffixes are this project's standard currency-conversion unit variants (not a measure explosion) and were kept for every retained base measure. Kept the top 2 hierarchy levels of the money/quasi-money flow breakdown (8 base measures x 3 units = 24 of 39).
pahlavi__monetary_survey_1963_70,trim,66,assets_liabilities_total|assets_liabilities_total.USD_NOMINAL|assets_liabilities_total.USD_REAL_2015|foreign_assets_net|foreign_assets_net.USD_NOMINAL|foreign_assets_net.USD_REAL_2015|claims_on_private_sector|claims_on_private_sector.USD_NOMINAL|claims_on_private_sector.USD_REAL_2015|claims_on_public_sector|claims_on_public_sector.USD_NOMINAL|claims_on_public_sector.USD_REAL_2015|money_supply|money_supply.USD_NOMINAL|money_supply.USD_REAL_2015|money_supply_currency_of_which|money_supply_currency_of_which.USD_NOMINAL|money_supply_currency_of_which.USD_REAL_2015|money_supply_demand_deposits_of_which|money_supply_demand_deposits_of_which.USD_NOMINAL|money_supply_demand_deposits_of_which.USD_REAL_2015|time_and_savings_deposits|time_and_savings_deposits.USD_NOMINAL|time_and_savings_deposits.USD_REAL_2015|deposits_of_public_sector|deposits_of_public_sector.USD_NOMINAL|deposits_of_public_sector.USD_REAL_2015|public_sector_net|public_sector_net.USD_NOMINAL|public_sector_net.USD_REAL_2015|other_items_net|other_items_net.USD_NOMINAL|other_items_net.USD_REAL_2015|capital_accounts|capital_accounts.USD_NOMINAL|capital_accounts.USD_REAL_2015,"Dropped 3rd-level sub-splits: claims_on_public_sector's government_agencies/plan_organization/treasury breakdown (incl. the combined-bracket duplicate for 1968/69-1969/70), deposits_of_public_sector's equivalent 3-way sub-split, importers_deposits, and sdr_allocation.",,"Consolidated banking-system balance sheet. Kept top 2 hierarchy levels (assets/liabilities total, foreign assets, private/public-sector claims, money supply + its currency/demand-deposit split, time & savings deposits, public-sector deposits, public-sector net, other items, capital accounts) x 3 currency units = 36 of 66."
pahlavi__money_quasi_money_changes_1965_71,trim,54,money_and_quasi_money|money_and_quasi_money.USD_NOMINAL|money_and_quasi_money.USD_REAL_2015|domestic_assets_net|domestic_assets_net.USD_NOMINAL|domestic_assets_net.USD_REAL_2015|foreign_assets_net|foreign_assets_net.USD_NOMINAL|foreign_assets_net.USD_REAL_2015|claims_on_public_sector_net|claims_on_public_sector_net.USD_NOMINAL|claims_on_public_sector_net.USD_REAL_2015|domestic_assets_net_claims_on_private_sector|domestic_assets_net_claims_on_private_sector.USD_NOMINAL|domestic_assets_net_claims_on_private_sector.USD_REAL_2015|money_and_quasi_money_currency_in_circulation|money_and_quasi_money_currency_in_circulation.USD_NOMINAL|money_and_quasi_money_currency_in_circulation.USD_REAL_2015|money_and_quasi_money_demand_deposits|money_and_quasi_money_demand_deposits.USD_NOMINAL|money_and_quasi_money_demand_deposits.USD_REAL_2015|money_and_quasi_money_time_and_savings_deposits|money_and_quasi_money_time_and_savings_deposits.USD_NOMINAL|money_and_quasi_money_time_and_savings_deposits.USD_REAL_2015|other_items_net_increase_shown_as_negative|other_items_net_increase_shown_as_negative.USD_NOMINAL|other_items_net_increase_shown_as_negative.USD_REAL_2015|changes_in_percent_money_supply_and_quasi_money|changes_in_percent_money_supply_and_quasi_money.USD_NOMINAL|changes_in_percent_money_supply_and_quasi_money.USD_REAL_2015,"Dropped claims_on_public_sector_net's national_government/official_entities sub-split, the redundant changes_in_percent_claims_on_private_sector, the combined-bracket currency-in-circulation-and-demand-deposits duplicate (a 1970/71-only source quirk), and other_items_net_increase's 4 sub-items (capital_accounts, import_deposits, other_items, sdr_allocation).",,"Sibling chart to monetary_aggregates_movements and monetary_survey (overlapping period, same 3-way currency unit doubling). Kept the same headline-level treatment: 10 base measures x 3 units = 30 of 54."
pahlavi__money_supply_changes_1957_59,trim,20,money_supply|time_and_savings_deposits|total_money_supply_time_and_savings_deposits|claims_on_government|net_claims_on_government|claims_on_official_entities|claims_on_private_sector_total,"Dropped the Bank-Melli-vs-deposit-banks sub-split of private-sector claims (redundant with the total), government_deposits (derivable from claims_on_government minus net_claims), and all 8 ""change_in_X"" delta series plus the 2 ""foreign_assets change"" series -- these duplicate the level variables under two different measurement conventions (vs. previous column / vs. prior 12 months).",,"Kept 7 level variables (money supply, time & savings deposits, their sum, claims on government, net claims on government, claims on official entities, claims on private sector total), all with a genuine 5-point semi-annual series 1957-1959. Dropped the derived period-over-period change series."
