chart_id,action,n_variants_before,keep_variant_codes,drop_reason,split_into,notes
pahlavi_hh__dairy_consumption_supply_1972_1977,split,47,consumption_total_total_fat_equivalent_tons|high_value_consumption_cream_fat_equivalent_tons|high_value_consumption_fresh_milk_fat_equivalent_tons|high_value_consumption_powdered_milk_fat_equivalent_tons|high_value_consumption_yogurt_urban_fat_equivalent_tons|low_value_consumption_butter_fat_equivalent_tons|low_value_consumption_butter_oil_fat_equivalent_tons|low_value_consumption_cheese_fat_equivalent_tons|low_value_consumption_yogurt_rural_fat_equivalent_tons|supply_total_total_head_000_fat_equivalent_tons|high_cost_milk_supply_cross_bred_cows_fat_equivalent_tons|high_cost_milk_supply_pure_bred_cows_fat_equivalent_tons|low_cost_milk_supply_buffaloes_fat_equivalent_tons|low_cost_milk_supply_goats_fat_equivalent_tons|low_cost_milk_supply_local_cows_fat_equivalent_tons|low_cost_milk_supply_sheep_fat_equivalent_tons,"Dropped the pct_of_total variants (derived %) and the product_000tons_or_000head variants (a second, non-comparable raw unit) for every category, keeping only fat_equivalent_tons -- the standardized unit that makes different dairy products and milk sources comparable.","Dairy Product Consumption by Type, Fat-Equivalent Tons (1972, 1977p) [9 variants: consumption_total + 8 product types] | Milk Supply by Animal Source, Fat-Equivalent Tons (1972, 1977p) [7 variants: supply_total + 6 animal sources]","Title itself names two measures (""Dairy Product Consumption & Livestock Supply""). Split into a consumption-by-product-type chart and a supply-by-animal-source chart. Only 2 years of data (1972, 1977 projected) but that is a genuine 2-point time series, consistent with how other thin-but-real charts in this batch were treated."
pahlavi_hh__expenditure_levels_rials_1965_1971,trim,28,urban_total_expenditure|rural_total_expenditure|urban_expenditure_food_and_tobacco|rural_expenditure_food_and_tobacco|urban_expenditure_non_food_items|rural_expenditure_non_food_items|urban_housing|rural_housing|urban_education|rural_education,"Dropped households_surveyed (a sample-size metadata field, not an economic measure) and 8 of 12 expenditure categories (household_operation, household_effects, clothing, personal_care_and_health, transportation, recreation, gifts_and_donations, others) for both urban and rural.",,"Cross-tab of (urban/rural) x (14 categories); urban-vs-rural is a genuinely informative divide for Pahlavi-era household economics so it was kept, but the category dimension was collapsed to 5 headline items (total expenditure, food vs. non-food split, housing, education). 10 of 28 variants, all with a real 7-year series (1965-1971)."
pahlavi_hh__expenditure_shares_by_category_1965_1971,trim,26,rural_expenditure_food_and_tobacco_share|urban_expenditure_food_and_tobacco_share|rural_expenditure_non_food_items_share|urban_expenditure_non_food_items_share|rural_housing_share|urban_housing_share|rural_education_share|urban_education_share|rural_clothing_share|urban_clothing_share,"Dropped households_surveyed (not a share metric) and 7 of 11 category shares (household_operation, household_effects, personal_care_and_health, transportation, recreation, gifts_and_donations, other) for both urban and rural.",,"Companion % chart to expenditure_levels_rials_1965_1971 with the same cross-tab shape; applied the same trim logic (keep urban/rural, collapse category to 5 headline shares, here substituting clothing for education's place to match this chart's own available variants). 10 of 26 variants."
wb_poverty__iran_poverty_rate_by_region_2011_2020,trim,18,central_poverty_rate|tehran_metro_poverty_rate|northwest_poverty_rate|zagros_poverty_rate|caspian_poverty_rate|persian_gulf_poverty_rate|northeast_poverty_rate|southeast_poverty_rate|national_poverty_rate,"Dropped the 9 ""*_poverty_rate_change_2011_2020"" variants -- each has year='' (a derived delta summary stat, not an actual time-series point).",,"Region breakdown is the point of a ""by Region"" chart, so all 8 macro-regions plus the national rate were kept, each with the real 2011 and 2020 data points. The derived ""change"" variants, which carry no year and duplicate information already in the 2 kept points, were dropped."
white_revolution__corps_stats_bundle_1963_1978,hide,20,,,,"Grab-bag of 20 one-off White Revolution program facts (health corps, literacy corps, reconstruction-development corps, general education enrollment, land reform), spanning multiple unrelated sub-programs. 19 of 20 variants are single-year (n=1) snapshots; only literacy_corps_national_literacy_rate has 2 points (1963, 1978). No single measure here is genuinely tracked over time -- propose hiding the whole chart rather than leaving a near-empty 1-variant remnant."
