country_iso3,country_name,year,value,unit,variant_code,variant_label,source_dataset,notes
IRN,Iran,2018,55000000000,cigarettes/year,domestic_cigarette_consumption_ministry_of_health_estimate,Domestic cigarette consumption (Ministry of Health estimate),iran-tobacco-monopoly:tobacco-market-post-privatization-2018,"Three conflicting official/unofficial estimates given in the same article -- see the two rows below. Included together, not averaged, to preserve the actual reported range. [source: Tobacco Asia, 'Iran in Focus', 16 July 2018]"
IRN,Iran,2018,70000000000,cigarettes/year,domestic_cigarette_consumption_ministry_of_industries_mining_and_trade_estimate,Domestic cigarette consumption (Ministry of Industries Mining and Trade estimate),iran-tobacco-monopoly:tobacco-market-post-privatization-2018,"Alternative official estimate, same year -- illustrates the poor state of post-privatization consumption data. [source: Tobacco Asia, 'Iran in Focus', 16 July 2018]"
IRN,Iran,2018,90000000000,cigarettes/year,domestic_cigarette_consumption_unofficial_market_estimate,Domestic cigarette consumption (unofficial/market estimate),iran-tobacco-monopoly:tobacco-market-post-privatization-2018,"Unofficial estimate, described in the source as exceeding both official figures. [source: Tobacco Asia, 'Iran in Focus', 16 July 2018]"
IRN,Iran,2018,10000000,people,active_smokers,Active smokers,iran-tobacco-monopoly:tobacco-market-post-privatization-2018,"Equivalent to 12.5% of Iran's then population of ~80 million; only ~4% of smokers were female. [source: Tobacco Asia, 'Iran in Focus', 16 July 2018]"
IRN,Iran,2018,80,percent,share_of_tobacco_leaf_that_must_be_imported,Share of tobacco leaf that must be imported,iran-tobacco-monopoly:tobacco-market-post-privatization-2018,"Reflects the collapse of domestic cultivation capacity since the Pahlavi-era self-sufficiency levels (compare 1940: 13,500 tons annual output, self-sufficient -- see sibling dataset iranica-tobacco-monopoly-narrative-series-1890-1995). [source: Tobacco Asia, 'Iran in Focus', 16 July 2018]"
IRN,Iran,2018,17.5,percent,iranian_tobacco_company_market_share,Iranian Tobacco Company market share,iran-tobacco-monopoly:tobacco-market-post-privatization-2018,"Given as a range 'hovering around 15-20%'; midpoint used. ITC (successor to the historic state Dokhaniyat monopoly) was privatized in 2012; by 2018 the market leader was Japan Tobacco International (JTI) with just over 50% share -- a striking reversal from a century of state monopoly. [source: Tobacco Asia, 'Iran in Focus', 16 July 2018]"
