law_id,importance,domains,why,year,title_fa,path
0d6222b19951,moderate,privatization,Amends law on transferring state-owned shares to veterans/workers,1998,قانون اصلاح تبصره (۱) ماده (۶) و ماده (۸) قانون نحوه واگذاری سهام دولتی و متعلق به دولت به ایثارگران و کارگران با اصلاحات و الحاقات بعدی,/Users/rohamhosseini/Documents/scraper simple/laws_clean/general_laws/1216279487495773789_1216279487495773789.txt
c7952ceedbd1,minor,oil_gas|budget_fiscal,Law on collecting Iran's oil-export receivables owed by Tanzania,1997,قانون چگونگي  وصول  مطالبات  دولت  جمهور ... زانيا ناشي  از صدور نفت به  كشور ياد شده,/Users/rohamhosseini/Documents/scraper simple/laws_clean/general_laws/قانون_چگونگي__وصول__مطالبات__دولت__جمهور_..._زانيا_ناشي__از_صدور_نفت_به__كشور_ياد_شده_18380211431962564951.txt
959059806a5c,moderate,housing,Law encouraging housing savings,1967,قانون تشويق پس انداز مسكن,/Users/rohamhosseini/Documents/scraper simple/laws_clean/general_laws/قانون_تشويق_پس_انداز_مسكن_377206383880573301.txt
6ff599d4fd1d,moderate,customs_trade|industry,"Exempts imported/domestic machinery, vehicles and parts from certain levies",1997,قانون مستثني شدن ماشين آلات، خودروهاي اه ... اهسازي وارداتي و  ساخت داخل و قطعات آنها,/Users/rohamhosseini/Documents/scraper simple/laws_clean/general_laws/قانون_مستثني_شدن_ماشين_آلات،_خودروهاي_اه_..._اهسازي_وارداتي_و__ساخت_داخل_و_قطعات_آنها_2845729008117474189.txt
cc8eb320bd97,minor,privatization,Transfers shares of Lorestan meat industrial complex to Bank Melli,1988,قانون واگذاري سهام مجتمع صنعتي گوشت لرستان به بانك ملي,/Users/rohamhosseini/Documents/scraper simple/laws_clean/general_laws/قانون_واگذاري_سهام_مجتمع_صنعتي_گوشت_لرستان_به_بانك_ملي_4874070440659832491.txt
02df3c8ab349,minor,banking_money|industry,Adds a credit-allocation note for Bank of Industry and Mining,1971,قانون اضافه كردن يك تبصره بقانون اجازه ا ... ل اعتبار ببانك توسعه صنعتي و معدني ايران,/Users/rohamhosseini/Documents/scraper simple/laws_clean/general_laws/قانون_اضافه_كردن_يك_تبصره_بقانون_اجازه_ا_..._ل_اعتبار_ببانك_توسعه_صنعتي_و_معدني_ايران_11927707133396057997.txt
b1d67fa60d0d,major,agriculture,"Establishes Ministry of Land Reform and Rural Cooperation, instrument of land reform policy",1967,قانون  تشكيل  وزارت  اصلاحات  ارضي  و تعاون  روستايي,/Users/rohamhosseini/Documents/scraper simple/laws_clean/general_laws/قانون__تشكيل__وزارت__اصلاحات__ارضي__و_تعاون__روستايي_2174214203614462015.txt
b6157695cdee,moderate,customs_trade,Decree exempting imported goods from customs duties and commercial profit for 1359,1980,لايحه قانوني راجع به معافيت كالاهاي وارد ... ز حقوق گمركي و سود بازرگاني در سال  1359,/Users/rohamhosseini/Documents/scraper simple/laws_clean/general_laws/لايحه_قانوني_راجع_به_معافيت_كالاهاي_وارد_..._ز_حقوق_گمركي_و_سود_بازرگاني_در_سال__1359_6422459325628946172.txt
8f1ba3004d50,moderate,taxation|customs_trade,"Abolishes city-gate tolls (عوارض دروازه‌ای), a direct fiscal/trade instrument",1969,قانون لغو عوارض دروازه‌ای با اصلاحات و الحاقات بعدی,/Users/rohamhosseini/Documents/scraper simple/laws_clean/general_laws/1875564140363301999_1875564140363301999.txt
99bca2bb5b57,minor,privatization|banking_money,Repayment of bonds issued to broaden ownership of production units,1986,قانون بازپرداخت  اوراق  قرضه گسترش مالكيت واحدهاي توليدي,/Users/rohamhosseini/Documents/scraper simple/laws_clean/general_laws/قانون_بازپرداخت__اوراق__قرضه_گسترش_مالكيت_واحدهاي_توليدي_17201168557485621520.txt
3aa25692eef6,minor,agriculture|banking_money,Authorizes Agricultural Development Bank loan to state companies,1979,لايحه قانوني مربوط به اجازه اعطاي وام بانك توسعه كشاورزي به شركتهاي دولتي,/Users/rohamhosseini/Documents/scraper simple/laws_clean/general_laws/لايحه_قانوني_مربوط_به_اجازه_اعطاي_وام_بانك_توسعه_كشاورزي_به_شركتهاي_دولتي_14234826744076985950.txt
2169fc95b752,moderate,agriculture|welfare,Amends law on drought-damage prevention and compensation,2002,قانون اصلاح قانون پيشگيري از عوارض ناشي از خشكسالي و جبران خسارات مصوب 1380,/Users/rohamhosseini/Documents/scraper simple/laws_clean/general_laws/قانون_اصلاح_قانون_پيشگيري_از_عوارض_ناشي_از_خشكسالي_و_جبران_خسارات_مصوب_1380_1177608173958026307.txt
1adacfe7bff6,major,agriculture|prices,Amends law guaranteeing purchase prices for basic agricultural products,1989,قانون اصلاح قانون تضمين خريد محصولات اساسي كشاورزي مصوب 1368 6 21,/Users/rohamhosseini/Documents/scraper simple/laws_clean/general_laws/قانون_اصلاح_قانون_تضمين_خريد_محصولات_اساسي_كشاورزي_مصوب_1368_6_21_240054080620806674.txt
dec2862647ef,moderate,customs_trade|taxation,Executive bylaw for levying duties/tariffs in free trade-industrial zones,2021,آيين نامه اجرايي اخذ عوارض در مناطق آزاد تجاري - صنعتي جمهوري اسلامي ايران,/Users/rohamhosseini/Documents/scraper simple/laws_clean/Aeen-Nameh/آيين_نامه_اجرايي_اخذ_عوارض_در_مناطق_آزاد_تجاري_-_صنعتي_جمهوري_اسلامي_ايران_13839241813856015768.txt
1225e9b4beec,moderate,taxation,Executive bylaw for Article 26 of the direct taxation law,2016,آيين نامه اجرايي ماده  26  اصلاحي قانون ماليات هاي مستقيم - مصوب 1394,/Users/rohamhosseini/Documents/scraper simple/laws_clean/Aeen-Nameh/آيين_نامه_اجرايي_ماده__26__اصلاحي_قانون_ماليات_هاي_مستقيم_-_مصوب_1394_17134945184663882428.txt
21af0876a20f,moderate,industry|budget_fiscal,Executive bylaw on a note concerning competitive production and financial system upgrading,2015,آيين نامه اجرايي تبصره  2  اصلاحي ماده   ... توليد رقابت پذير و ارتقاي نظام مالي كشور,/Users/rohamhosseini/Documents/scraper simple/laws_clean/Aeen-Nameh/آيين_نامه_اجرايي_تبصره__2__اصلاحي_ماده___..._توليد_رقابت_پذير_و_ارتقاي_نظام_مالي_كشور_5406755927993242525.txt
125fb5c1e448,minor,privatization,Amends bylaw on transfer of preferred shares in privatization,2015,اصلاح مواد  8  و  9   آيين نامه اجرائي ت ... يين نامه اجرايي نحوه واگذاري سهام ترجيحي,/Users/rohamhosseini/Documents/scraper simple/laws_clean/Aeen-Nameh/اصلاح_مواد__8__و__9___آيين_نامه_اجرائي_ت_..._يين_نامه_اجرايي_نحوه_واگذاري_سهام_ترجيحي_17022991867400950528.txt
e7e2c3a6a46a,moderate,agriculture|housing,Bylaw issuing ownership title deeds for lands covered by land reform,1995,آيين نامه اجرايي قانون صدور اسناد مالكيت ... ل اصلاحات ارضي در روستاها و شهرهاي مشمول,/Users/rohamhosseini/Documents/scraper simple/laws_clean/Aeen-Nameh/آيين_نامه_اجرايي_قانون_صدور_اسناد_مالكيت_..._ل_اصلاحات_ارضي_در_روستاها_و_شهرهاي_مشمول_4734971951218664803.txt
c1b60bb8d2b7,minor,budget_fiscal,Executive bylaw for a budget-law clause carrying a specific credit allocation,2006,آيين نامه اجرايي بند 16  تبصره 2  قانون بودجه سال 1385 كل كشور,/Users/rohamhosseini/Documents/scraper simple/laws_clean/Aeen-Nameh/آيين_نامه_اجرايي_بند_16__تبصره_2__قانون_بودجه_سال_1385_كل_كشور_9727414834319762168.txt
e5897c29b855,minor,budget_fiscal,Executive bylaw implementing a budget-law note with a fiscal instrument,2017,آيين نامه اجرايي بند  الف  تبصره  19  قانون بودجه سال 1396 كل كشور,/Users/rohamhosseini/Documents/scraper simple/laws_clean/Aeen-Nameh/آيين_نامه_اجرايي_بند__الف__تبصره__19__قانون_بودجه_سال_1396_كل_كشور_9270566206493451095.txt
4d5b81efd31a,moderate,banking_money|budget_fiscal,Directive on repayment terms for facilities granted from the Oil Stabilization/Foreign Exchange Reserve Account,2009,دستورالعمل اجرايي ضوابط بازپرداخت تسهيلات اعطايي ازمحل حساب ذخيره ارزي,/Users/rohamhosseini/Documents/scraper simple/laws_clean/Aeen-Nameh/دستورالعمل_اجرايي_ضوابط_بازپرداخت_تسهيلات_اعطايي_ازمحل_حساب_ذخيره_ارزي_2467304675322848306.txt
b7ab9bcb255b,minor,banking_money,"Disciplinary directive for issuers listed on Tehran Stock Exchange, affects market instrument compliance",2009,دستورالعمل انضباطي ناشران پذيرفته شده در بورس اوراق بهادار تهران,/Users/rohamhosseini/Documents/scraper simple/laws_clean/Aeen-Nameh/دستورالعمل_انضباطي_ناشران_پذيرفته_شده_در_بورس_اوراق_بهادار_تهران_5968274889553102514.txt
9bb2a9f3bded,major,budget_fiscal,National budget law FY1328 sets government spending/revenue,1949,قانون بودجه سال 1328 كل كشور,/Users/rohamhosseini/Documents/scraper simple/laws_clean/general_laws/قانون_بودجه_سال_1328_كل_كشور_8583334866475183383.txt
fdff449d7e22,moderate,agriculture,"Land ownership of Dez dam catchment area, abolishes agribusiness contracts",1979,لايحه قانوني مالكيت و بهره برداري از ارا ... آبخورسد دز و الغاء قراردادهاي كشت و صنعت,/Users/rohamhosseini/Documents/scraper simple/laws_clean/general_laws/لايحه_قانوني_مالكيت_و_بهره_برداري_از_ارا_..._آبخورسد_دز_و_الغاء_قراردادهاي_كشت_و_صنعت_8350197496330154355.txt
37d1df01b1bb,moderate,energy,Construction/operation of Lar and Latian dams (water/power infrastructure),1958,قانون راجع به ساختمان و بهره برداري سد و تأسيسات لار و لتيان,/Users/rohamhosseini/Documents/scraper simple/laws_clean/general_laws/قانون_راجع_به_ساختمان_و_بهره_برداري_سد_و_تأسيسات_لار_و_لتيان_16752050233414559419.txt
3e1ffd07348f,major,oil_gas,"Gulf oil company contract law, major petroleum sector agreement",1965,قانون قرارداد شركت نفت خليج فارس,/Users/rohamhosseini/Documents/scraper simple/laws_clean/general_laws/قانون_قرارداد_شركت_نفت_خليج_فارس_791740643977371266.txt
a2b5d76bfee0,moderate,banking_money,"Establishes Central Insurance of Iran, structuring insurance industry",1971,قانون تأسيس بيمه مركزي ايران و بيمه گري,/Users/rohamhosseini/Documents/scraper simple/laws_clean/general_laws/قانون_تأسيس_بيمه_مركزي_ايران_و_بيمه_گري_9291524794440757221.txt
5580d3793d26,moderate,banking_money|agriculture,"Forms Agricultural Cooperative Bank of Iran, an agri credit institution",1969,قانون تشكيل بانك تعاون كشاورزي ايران,/Users/rohamhosseini/Documents/scraper simple/laws_clean/general_laws/قانون_تشكيل_بانك_تعاون_كشاورزي_ايران_17105436075285289190.txt
0d79c3d26d68,moderate,budget_fiscal,Supplementary budget law for FY1345,1966,قانون متمم بودجه سال 1345 كل كشور,/Users/rohamhosseini/Documents/scraper simple/laws_clean/general_laws/قانون_متمم_بودجه_سال_1345_كل_كشور_7758356384907608388.txt
5b567813cf71,moderate,energy|industry,Bylaw on power/fuel supply arrangements for industries,2009,آيين نامه نحوه تأمين برق و سوخت صنايع,/Users/rohamhosseini/Documents/scraper simple/laws_clean/Aeen-Nameh/آيين_نامه_نحوه_تأمين_برق_و_سوخت_صنايع_7757504735496753654.txt
58e8aa8fbe61,minor,banking_money,Establishes national credit-scoring system affecting lending,2019,آيين نامه نظام سنجش اعتبار,/Users/rohamhosseini/Documents/scraper simple/laws_clean/Aeen-Nameh/آيين_نامه_نظام_سنجش_اعتبار_18373177109780792401.txt
4118fa5d9360,moderate,privatization,Procedure for allocating Justice Shares (privatization instrument) to journalists,2008,دستورالعمل فرآيند شناسايي و تاييد نهايي مشمولان طرح واگذاري سهام عدالت به روزنامه نگاران,/Users/rohamhosseini/Documents/scraper simple/laws_clean/Aeen-Nameh/دستورالعمل_فرآيند_شناسايي_و_تاييد_نهايي_مشمولان_طرح_واگذاري_سهام_عدالت_به_روزنامه_نگاران_9088672742456059476.txt
ee348aa6369a,moderate,banking_money,Annual policy/supervisory directives for the banking network,2009,ضوابط سياستي- نظارتي شبكه بانكي كشور درسال 1388,/Users/rohamhosseini/Documents/scraper simple/laws_clean/Aeen-Nameh/ضوابط_سياستي-_نظارتي_شبكه_بانكي_كشور_درسال_1388_14383574616497670097.txt
ef4b65b26b5e,moderate,banking_money|budget_fiscal,Financial/procurement bylaw governing National Development Fund operations,2011,آيين نامه مالي، معاملاتي، اداري و استخدامي صندوق توسعه ملي,/Users/rohamhosseini/Documents/scraper simple/laws_clean/Aeen-Nameh/آيين_نامه_مالي،_معاملاتي،_اداري_و_استخدامي_صندوق_توسعه_ملي_728251178839436233.txt
7ba0519df5f9,moderate,customs_trade,"Implementing bylaw for Export/Import Regulations Act, sets trade rules",1988,آيين نامه اجرايي قانون مقررات صادرات و و ... جرايي قانون مقررات صادرات و واردات 1369,/Users/rohamhosseini/Documents/scraper simple/laws_clean/Aeen-Nameh/آيين_نامه_اجرايي_قانون_مقررات_صادرات_و_و_..._جرايي_قانون_مقررات_صادرات_و_واردات_1369__13795177152072114598.txt
a24daceb90b7,moderate,customs_trade,Directive setting customs duty on imported mobile phones,,دستورالعمل حقوق ورودي گوشي  تلفن همراه خ ... امه شماره1901562  1403 مورخ 28  12  1402,/Users/rohamhosseini/Documents/scraper simple/laws_clean/Aeen-Nameh/دستورالعمل_حقوق_ورودي_گوشي__تلفن_همراه_خ_..._امه_شماره1901562__1403_مورخ_28__12__1402_11938971201069855529.txt
7350627d895c,moderate,agriculture,Bylaw preventing fragmentation of farmland into uneconomic parcels,2017,آيين نامه اجرايي قانون جلوگيري از خردشدن اراضي كشاورزي و ايجاد قطعات مناسب فني، اقتصادي,/Users/rohamhosseini/Documents/scraper simple/laws_clean/Aeen-Nameh/آيين_نامه_اجرايي_قانون_جلوگيري_از_خردشدن_اراضي_كشاورزي_و_ايجاد_قطعات_مناسب_فني،_اقتصادي_14682453051237130333.txt
62e9c12193f7,moderate,welfare|housing,"Fund for employment, marriage and housing (Mehr) support",2007,آيين نامه صندوق اشتغال، ازدواج و مسكن مهر امام رضا  ع,/Users/rohamhosseini/Documents/scraper simple/laws_clean/Aeen-Nameh/آيين_نامه_صندوق_اشتغال،_ازدواج_و_مسكن_مهر_امام_رضا__ع__4583919636289781003.txt
8c3abd02eb14,moderate,energy,Implementing bylaw for energy consumption pattern reform law,2016,آيين نامه اجرايي ماده  61  قانون اصلاح الگوي مصرف انرژي,/Users/rohamhosseini/Documents/scraper simple/laws_clean/Aeen-Nameh/آيين_نامه_اجرايي_ماده__61__قانون_اصلاح_الگوي_مصرف_انرژي_10097719255361062206.txt
304d65293ccc,moderate,customs_trade,Special export credit facility for Afghanistan,2003,آيين نامه  اعطاي  اعتبارات  صادراتي  ويژه  افغانستان,/Users/rohamhosseini/Documents/scraper simple/laws_clean/Aeen-Nameh/آيين_نامه__اعطاي__اعتبارات__صادراتي__ويژه__افغانستان_2509942832751384817.txt
e62341dc36e0,minor,prices,Amends payment/pricing procedure for buyers under an implementing bylaw,2006,الحاق ماده  6  به آيين نامه اجرايي شيوه  ... فيفها و چگونگي پرداخت قيمت توسط خريداران,/Users/rohamhosseini/Documents/scraper simple/laws_clean/Aeen-Nameh/الحاق_ماده__6__به_آيين_نامه_اجرايي_شيوه__..._فيفها_و_چگونگي_پرداخت_قيمت_توسط_خريداران_13637533224663322880.txt
318b44009f5a,moderate,customs_trade|industry,"Bylaws on imported vs domestically-made road-building machinery, affecting tariffs/industry",1993,آئين نامه هاي اجرائي موضوع تبصره هاي 1،  ... و ماشين آلات راهسازي وارداتي و ساخت داخل,/Users/rohamhosseini/Documents/scraper simple/laws_clean/Aeen-Nameh/آئين_نامه_هاي_اجرائي_موضوع_تبصره_هاي_1،__..._و_ماشين_آلات_راهسازي_وارداتي_و_ساخت_داخل_7016240628178100751.txt
49379f524e01,minor,budget_fiscal,Execution rules for FY1381 budget,2002,ضوابط اجرايي بودجه سال 1381كل كشور,/Users/rohamhosseini/Documents/scraper simple/laws_clean/Aeen-Nameh/ضوابط_اجرايي_بودجه_سال_1381كل_كشور_6505079506778810326.txt
8e0b98216e43,moderate,industry,Support scheme for establishing large centralized carpet-weaving complexes,2006,آيين نامه اجرايي قانون حمايت از تاسيس و اداره مجتمعهاي بزرگ و متمركز قاليبافي,/Users/rohamhosseini/Documents/scraper simple/laws_clean/Aeen-Nameh/آيين_نامه_اجرايي_قانون_حمايت_از_تاسيس_و_اداره_مجتمعهاي_بزرگ_و_متمركز_قاليبافي_13351651444512077947.txt
8181f925bae9,moderate,labor|banking_money,Employment credit facilities bylaw under FY1366 budget,1987,آئيننامه اجرائي تسهيلات اعتباري اشتغال  ... ضوع تبصره 3 قانون بودجه سال 1366 كل كشور,/Users/rohamhosseini/Documents/scraper simple/laws_clean/Aeen-Nameh/_آئيننامه_اجرائي_تسهيلات_اعتباري_اشتغال__..._ضوع_تبصره_3_قانون_بودجه_سال_1366_كل_كشور_4680353100424955924.txt
738dd42800f6,moderate,labor|banking_money,Employment credit facilities bylaw under FY1367 budget,1988,آئين نامه اجرائي تسهيلات اعتباري اشتغال  ... د 4 تبصره 3 قانون بودجه سال 1367 كل كشور,/Users/rohamhosseini/Documents/scraper simple/laws_clean/Aeen-Nameh/آئين_نامه_اجرائي_تسهيلات_اعتباري_اشتغال__..._د_4_تبصره_3_قانون_بودجه_سال_1367_كل_كشور_14983268405909353478.txt
587226e46d78,minor,banking_money,Disclosure/reporting regulation for insurance institutions,2014,آیین‌نامه شماره ۸۸، گزارشگری و افشای اطلاعات موسسات بیمه با اصلاحات و الحاقات بعدی,/Users/rohamhosseini/Documents/scraper simple/laws_clean/Aeen-Nameh/7576378184276778964_7576378184276778964.txt
33a1e45583ca,moderate,housing,Implementing bylaw for urban worn-out fabric renewal financing,2014,آيين نامه اجرايي تبصره  2  ماده  7  قانو ... و نوسازي بافت هاي فرسوده و ناكارآمد شهري,/Users/rohamhosseini/Documents/scraper simple/laws_clean/Aeen-Nameh/آيين_نامه_اجرايي_تبصره__2__ماده__7__قانو_..._و_نوسازي_بافت_هاي_فرسوده_و_ناكارآمد_شهري_5210761793839473598.txt
fd6fe14a9350,moderate,customs_trade,Cabinet economic commission decree amending export/import regulations bylaw,2010,تصويب نامه وزيران عضو كميسيون اقتصاد درم ... نامه اجرايي قانون مقررات صادرات و واردات,/Users/rohamhosseini/Documents/scraper simple/laws_clean/Aeen-Nameh/تصويب_نامه_وزيران_عضو_كميسيون_اقتصاد_درم_..._نامه_اجرايي_قانون_مقررات_صادرات_و_واردات_5073681760648107433.txt
bd59d69c753c,major,banking_money,"Regulates the unorganized (informal) money market, a major monetary policy instrument",2007,آيين نامه اجرايي قانون تنظيم بازار غيرمتشكل پولي,/Users/rohamhosseini/Documents/scraper simple/laws_clean/Aeen-Nameh/آيين_نامه_اجرايي_قانون_تنظيم_بازار_غيرمتشكل_پولي_4675889867219588353.txt
f8b65dacabc0,major,privatization,"Amends Article 44 preferential share transfer bylaw, core privatization mechanism",2011,تصویبنامه شورای عالی اجرای سیاستهای کلی اصل چهل و چهارم (۴۴) قانون اساسی در خصوص اصلاح تبصره (۲) ماده (۳) و ماده (۷) آییننامه نحوه واگذاری سهام ترجیحی با اصلاحات و الحاقات بعدی,/Users/rohamhosseini/Documents/scraper simple/laws_clean/Aeen-Nameh/15010057042269662693_15010057042269662693.txt
e00330e89954,moderate,energy,Implementing bylaw for energy consumption pattern reform law,2016,آيين نامه اجرايي مواد  4  و  7  قانون اصلاح الگوي مصرف انرژي,/Users/rohamhosseini/Documents/scraper simple/laws_clean/Aeen-Nameh/آيين_نامه_اجرايي_مواد__4__و__7__قانون_اصلاح_الگوي_مصرف_انرژي_15212973845051564376.txt
6629bc0f3846,moderate,budget_fiscal,Implements provisions of law on state financial regulations,2006,آیین‌نامه اجرایی ماده (۶) قانون الحاق موادی به قانون تنظیم بخشی از مقررات مالی دولت با اصلاحات و الحاقات بعدی,/Users/rohamhosseini/Documents/scraper simple/laws_clean/Aeen-Nameh/16067983237265474305_16067983237265474305.txt
4ad1c6956878,moderate,fx|customs_trade,Sets exchange rate basis used to calculate customs duties,2025,بخشنامه سازمان توسعه تجارت ايران درخصوص  ...  تغييرات نرخ ارز مبناي محاسبه حقوق ورودي,/Users/rohamhosseini/Documents/scraper simple/laws_clean/Divan_aali_votes/بخشنامه_سازمان_توسعه_تجارت_ايران_درخصوص__...__تغييرات_نرخ_ارز_مبناي_محاسبه_حقوق_ورودي_15557673107658444561.txt
1bee3a3598ad,moderate,prices,Court annuls sand/gravel price-setting authority of a working group,2021,رأي شماره 1362 هيأت عمومي ديوان عدالت اد ... ين قيمت شن و ماسه توسط كارگروه مذكور است,/Users/rohamhosseini/Documents/scraper simple/laws_clean/Divan_edalat_edari_votes/رأي_شماره_1362_هيأت_عمومي_ديوان_عدالت_اد_..._ين_قيمت_شن_و_ماسه_توسط_كارگروه_مذكور_است_5434574811745482603.txt
0e4f1ff9e1e4,minor,customs_trade,Ruling affecting fees imposed on goods importers,2016,رأي شماره 729 الي 737 هيأت عمومي ديوان ع ...  اي توسط واردكنندگان كالا از تاريخ تصويب,/Users/rohamhosseini/Documents/scraper simple/laws_clean/Divan_edalat_edari_votes/رأي_شماره_729_الي_737_هيأت_عمومي_ديوان_ع_...__اي_توسط_واردكنندگان_كالا_از_تاريخ_تصويب_12939527983203652745.txt
c4f2fb92ff73,moderate,taxation,Court annuls tax circular on capital-gains taxation of listed shares,2021,رأی شماره ۲۵۵۲ هﯿات عمومﯽ دﯾوان عدالت اداری با موضوع ابطال بخشنامه شماره ۲۰۰ / ۹۷ / ۱۷۷ - ۱۳۹۷ / ۱۲ / ۲۸ سازمان امور مالﯿاتﯽ کشور مبنی بر شمول مالﯿات بر درآمد در موارد اعلام ارزش بازار ﯾا خالص ارزش فروش در دفاتر موضوع سهام شرکت‌های پذﯾرفته شده در بورس ﯾا بازارهای مجاز مشابه ابطال شد با اصلاحات و الح,/Users/rohamhosseini/Documents/scraper simple/laws_clean/Divan_edalat_edari_votes/3841609063777107963_3841609063777107963.txt
