law_id,importance,domains,why,year,title_fa,path
b5fbfaa9e2b2,moderate,energy|prices,Annuls supplementary electricity tariff rules set by the Ministry of Energy.,2021,رأي شماره 1532 هيأت عمومي ديوان عدالت اد ... تكميلي تعرفه هاي برق وزارت نيرو ابطال شد,/Users/rohamhosseini/Documents/scraper simple/laws_clean/Divan_edalat_edari_votes/رأي_شماره_1532_هيأت_عمومي_ديوان_عدالت_اد_..._تكميلي_تعرفه_هاي_برق_وزارت_نيرو_ابطال_شد_12474500001480339045.txt
2aeb76aadd48,moderate,prices,Ruling concerning the body overseeing price controls and distribution of goods/services.,2005,رأي شماره 18 هيأت عمومي ديوان عدالت ادار ... رسي و نظارت بر قيمت و توزيع كالا و خدمات,/Users/rohamhosseini/Documents/scraper simple/laws_clean/Divan_edalat_edari_votes/رأي_شماره_18_هيأت_عمومي_ديوان_عدالت_ادار_..._رسي_و_نظارت_بر_قيمت_و_توزيع_كالا_و_خدمات_9571209960136445647.txt
005050a6cc38,moderate,taxation,"Annuls/reviews an amended clause of the Direct Taxes Act, affecting tax liabilities.",2019,رأي شماره 2463 - 2462 - 2461 هيأت عمومي  ...  اصلاحي قانون مالياتهاي مستقيم مصوب 1395,/Users/rohamhosseini/Documents/scraper simple/laws_clean/Divan_edalat_edari_votes/رأي_شماره_2463_-_2462_-_2461_هيأت_عمومي__...__اصلاحي_قانون_مالياتهاي_مستقيم_مصوب_1395_11704234984939844373.txt
0ca0ede60d88,minor,taxation,Ruling on a tax-authority directive affecting tax administration/assessment.,2021,راي شماره 1636 هيات عمومي ديوان عدالت اد ... 77 ـ 1397 12 28 سازمان امور مالياتي كشور,/Users/rohamhosseini/Documents/scraper simple/laws_clean/Divan_edalat_edari_votes/راي_شماره_1636_هيات_عمومي_ديوان_عدالت_اد_..._77_ـ_1397_12_28_سازمان_امور_مالياتي_كشور_11130791055015393795.txt
700adac6c455,major,labor,Court ruling on the presidential decree setting the minimum wage for workers.,2021,رأي شماره 2325 هيأت عمومي ديوان عدالت اد ...  جمهور  با موضوع تعيين حداقل مزد كارگران,/Users/rohamhosseini/Documents/scraper simple/laws_clean/Divan_edalat_edari_votes/رأي_شماره_2325_هيأت_عمومي_ديوان_عدالت_اد_...__جمهور__با_موضوع_تعيين_حداقل_مزد_كارگران_9245571007618507064.txt
9138f62088ed,major,privatization,Ruling concerning the transfer/privatization of the state telecom company to the private sector.,2018,رأي شماره هاي 1264 و 1317 هيأت عمومي ديو ...  با واگذاري شركت مخابرات به بخش غيردولتي,/Users/rohamhosseini/Documents/scraper simple/laws_clean/Divan_edalat_edari_votes/رأي_شماره_هاي_1264_و_1317_هيأت_عمومي_ديو_...__با_واگذاري_شركت_مخابرات_به_بخش_غيردولتي_4296388422628640024.txt
ee2df4f7fce1,moderate,customs_trade,"Annuls a directive under the Ministry of Commerce's import/export regulations, affecting trade rules.",2009,رأي شماره 747 هيأت عمومي ديوان عدالت ادا ... كل مقررات صادرات و واردات وزارت بازرگاني,/Users/rohamhosseini/Documents/scraper simple/laws_clean/Divan_edalat_edari_votes/رأي_شماره_747_هيأت_عمومي_ديوان_عدالت_ادا_..._كل_مقررات_صادرات_و_واردات_وزارت_بازرگاني_1511110535415753323.txt
f7a3b8088b25,minor,banking_money,Sets trading commissions for exchange-traded investment fund units on the bourse.,2013,كارمزد معاملات واحدهاي سرمايه گذاري صندوقهاي سرمايه گذاري قابل معامله در بورس   فرابورس,/Users/rohamhosseini/Documents/scraper simple/laws_clean/Aeen-Nameh/كارمزد_معاملات_واحدهاي_سرمايه_گذاري_صندوقهاي_سرمايه_گذاري_قابل_معامله_در_بورس___فرابورس_3899591117647465906.txt
59859dfe6897,minor,energy,Amends rules for spending credits on a compact-fluorescent-lamp energy-efficiency program.,2010,اصلاح مواد   1   و   4   آيين نامه نحوه هزينه اعتبارات طرح توسعه لامپ كم مصرف,/Users/rohamhosseini/Documents/scraper simple/laws_clean/Aeen-Nameh/اصلاح_مواد___1___و___4___آيين_نامه_نحوه_هزينه_اعتبارات_طرح_توسعه_لامپ_كم_مصرف_13931916035033206289.txt
a88f0fd027e6,minor,energy,Cabinet decree concerning Iran's power transmission and distribution company (Tavanir).,2005,تصويبنامه شماره ابلاغ 10138 ت 32181هـ مو ... نتقال وتوزيع نيروي برق ايران    توانير,/Users/rohamhosseini/Documents/scraper simple/laws_clean/Aeen-Nameh/تصويبنامه_شماره_ابلاغ_10138_ت_32181هـ_مو_..._نتقال_وتوزيع_نيروي_برق_ايران____توانير___2042243584340735528.txt
b8d351ae3e06,minor,fx|banking_money,"Implementing instructions for foreign investment in stock/OTC exchanges, affects capital inflows.",2011,دستورالعمل اجرايي آيين نامۀ سرمايه گذاري خارجي در بورس ها و بازارهاي خارج از بورس,/Users/rohamhosseini/Documents/scraper simple/laws_clean/Aeen-Nameh/دستورالعمل_اجرايي_آيين_نامۀ_سرمايه_گذاري_خارجي_در_بورس_ها_و_بازارهاي_خارج_از_بورس_17298913868729785468.txt
e33c7b47839b,moderate,energy,"Bylaw for fuel-consumption management/public transport development law, ties to fuel subsidy and consumption.",2010,آيين نامه اجرايي ماده  5  قانون توسعه حمل و نقل عمومي و مديريت مصرف سوخت - مصوب  1386,/Users/rohamhosseini/Documents/scraper simple/laws_clean/Aeen-Nameh/آيين_نامه_اجرايي_ماده__5__قانون_توسعه_حمل_و_نقل_عمومي_و_مديريت_مصرف_سوخت_-_مصوب__1386_6792161452613360287.txt
accee06627a8,minor,customs_trade,Amendment adding a clause to import/export regulations bylaw.,2012,الحاق بند  د  به ماده  11  مكرر آيين نامه اجرايي قانون مقررات صادرات و واردات,/Users/rohamhosseini/Documents/scraper simple/laws_clean/Aeen-Nameh/الحاق_بند__د__به_ماده__11__مكرر_آيين_نامه_اجرايي_قانون_مقررات_صادرات_و_واردات_11590614648532596618.txt
fdf41bac71e1,moderate,customs_trade,"Amendment to the executive bylaw of the Import/Export Regulations Law, affects trade rules.",2002,اصلاح آيين نامه اجرايي قانون مقررات صادرات و واردات,/Users/rohamhosseini/Documents/scraper simple/laws_clean/Aeen-Nameh/اصلاح_آيين_نامه_اجرايي_قانون_مقررات_صادرات_و_واردات_3406192287660018134.txt
0bb7ab565e9e,moderate,customs_trade,Amendment to executive bylaw of Import/Export Regulations Law.,1992,اصلاح آئين نامه اجرائي قانون مقررات صادرات و واردات,/Users/rohamhosseini/Documents/scraper simple/laws_clean/Aeen-Nameh/اصلاح_آئين_نامه_اجرائي_قانون_مقررات_صادرات_و_واردات_12570331093584863984.txt
14ed61533faf,moderate,customs_trade,Approval decree concerning executive bylaw of Import/Export Regulations Law.,,تصویب‌نامه در خصوص آیین‌نامه اجرایی قانون مقررات صادرات و واردات با اصلاحات و الحاقات بعدی,/Users/rohamhosseini/Documents/scraper simple/laws_clean/Aeen-Nameh/12479258132614824848_12479258132614824848.txt
9b9cb4f514ad,minor,customs_trade|fx,Adds a note on tariff/duty collection procedures in free trade-industrial zones.,,تصویبنامه راجع به اضافه شدن تبصره (۳) به بند ۸ اصلاحی دستورالعمل و روش اجرایی آیین‌نامه اخذ عوارض در مناطق آزاد تجاری – صنعتی با اصلاحات و الحاقات بعدی,/Users/rohamhosseini/Documents/scraper simple/laws_clean/Aeen-Nameh/4584892296133623807_4584892296133623807.txt
90a740d405f4,minor,customs_trade,Adds an exemption item to the ratified list under the import/export bylaw.,2005,تصویب ‎نامه راجع به الحاق تصویب‎ نامه موضوع فهرست مصوبات تنفیذی به ماده (۴۶) آیین‎ نامه اجرایی قانون مقررات صادرات و واردات با اصلاحات و الحاقات بعدی,/Users/rohamhosseini/Documents/scraper simple/laws_clean/Aeen-Nameh/15428813341737504619_15428813341737504619.txt
495bae5be0e6,moderate,taxation,"Executive bylaw for a note under the Direct Taxes Law, sets tax administration rules.",2016,آيين نامه اجرايي تبصره  1  ماده  149  اصلاحي قانون ماليات  هاي مستقيم - مصوب 1394-,/Users/rohamhosseini/Documents/scraper simple/laws_clean/Aeen-Nameh/آيين_نامه_اجرايي_تبصره__1__ماده__149__اصلاحي_قانون_ماليات__هاي_مستقيم_-_مصوب_1394-_10262523120812039567.txt
87a359852533,moderate,agriculture,"Executive bylaw of Agricultural Productivity Increase Law, article on resource allocation.",2015,آيين نامه اجرايي ماده  3  قانون افزايش بهره وري بخش كشاورزي و منابع طبيعي - مصوب 1389 -,/Users/rohamhosseini/Documents/scraper simple/laws_clean/Aeen-Nameh/آيين_نامه_اجرايي_ماده__3__قانون_افزايش_بهره_وري_بخش_كشاورزي_و_منابع_طبيعي_-_مصوب_1389_-_16996449296200812191.txt
42306942ec01,minor,agriculture,Amendment to bylaw under Agricultural Productivity Increase Law.,2017,اصلاح آيين نامه اجرايي تبصره  2  اصلاحي  ... فزايش بهره وري بخش كشاورزي و منابع طبيعي,/Users/rohamhosseini/Documents/scraper simple/laws_clean/Aeen-Nameh/اصلاح_آيين_نامه_اجرايي_تبصره__2__اصلاحي__..._فزايش_بهره_وري_بخش_كشاورزي_و_منابع_طبيعي_3987651946205162780.txt
ef60cf561694,minor,budget_fiscal,"Executive bylaw for state revenue collection law (Article 32), fiscal mechanism.",1993,آيين نامه اجرايي ماده  32  قانون وصول بر ... لت و مصرف آن در موارد معين - مصوب 1369 -,/Users/rohamhosseini/Documents/scraper simple/laws_clean/Aeen-Nameh/آيين_نامه_اجرايي_ماده__32__قانون_وصول_بر_..._لت_و_مصرف_آن_در_موارد_معين_-_مصوب_1369_-_539166734176132492.txt
c70125deee75,minor,banking_money|customs_trade,"Bylaw on opening documentary letters of credit under Public Accounting Law, affects trade financing.",1989,آيين نامه افتتاح اعتبار اسنادي موضوع ماده  62  قانون محاسبات عمومي كشور,/Users/rohamhosseini/Documents/scraper simple/laws_clean/Aeen-Nameh/آيين_نامه_افتتاح_اعتبار_اسنادي_موضوع_ماده__62__قانون_محاسبات_عمومي_كشور_10664756449205864522.txt
fea5028dcb7d,moderate,housing|banking_money,Bylaw authorizing Bank Maskan participation-bond (mosharekat) issuance for housing finance.,2007,آيين نامه انتشار اوراق مشاركت بانك مسكن  ...   تبصره  6  قانون بودجه سال 1386 كل كشور,/Users/rohamhosseini/Documents/scraper simple/laws_clean/Aeen-Nameh/آيين_نامه_انتشار_اوراق_مشاركت_بانك_مسكن__...___تبصره__6__قانون_بودجه_سال_1386_كل_كشور_8208912755763704602.txt
05be3d97f820,minor,customs_trade,"Rules on reserve fund of Export Guarantee Fund of Iran, supports export credit insurance.",1997,آيين نامه چگونگي تشكيل و نحوه استفاده از اندوخته احتياطي صندوق ضمانت صادرات ايران,/Users/rohamhosseini/Documents/scraper simple/laws_clean/Aeen-Nameh/آيين_نامه_چگونگي_تشكيل_و_نحوه_استفاده_از_اندوخته_احتياطي_صندوق_ضمانت_صادرات_ايران_2686700770945080440.txt
489a2d0e45bc,moderate,oil_gas,"Bylaw defining and governing procedures for major oil contracts, shapes upstream investment terms.",2017,آيين نامه تشخيص قراردادهاي مهم نفتي و نحوه انعقاد آنها,/Users/rohamhosseini/Documents/scraper simple/laws_clean/Aeen-Nameh/آيين_نامه_تشخيص_قراردادهاي_مهم_نفتي_و_نحوه_انعقاد_آنها_1463708414825351500.txt
fe16596fce84,minor,banking_money,Amendment to rules on debt collection powers of credit institutions in rial and forex claims.,2014,اصلاح ماده  11  تصويب نامه شماره 153965  ... وك الوصول موسسات اعتباري  ريالي و ارزي,/Users/rohamhosseini/Documents/scraper simple/laws_clean/Aeen-Nameh/اصلاح_ماده__11__تصويب_نامه_شماره_153965__..._وك_الوصول_موسسات_اعتباري__ريالي_و_ارزي___6622670811405036510.txt
4d57547d4b61,minor,taxation,Historic (1935) regulation implementing a 3% municipal tax and tolls law.,1935,نظامنامه قانون ماليات صدي سه و عوارض بلدي,/Users/rohamhosseini/Documents/scraper simple/laws_clean/Aeen-Nameh/نظامنامه_قانون_ماليات_صدي_سه_و_عوارض_بلدي_14327508441294365550.txt
a0826dfb427a,minor,banking_money,Directive on listing/offering securities on Iran Fara Bourse (OTC market).,2009,دستورالعمل پذيرش و عرضه اوراق بهادار در فرابورس ايران  شركت سهامي عام,/Users/rohamhosseini/Documents/scraper simple/laws_clean/Aeen-Nameh/دستورالعمل_پذيرش_و_عرضه_اوراق_بهادار_در_فرابورس_ايران__شركت_سهامي_عام__9900057021460127210.txt
44ee3bfab767,minor,banking_money,Directive on trading rules for the base/junior market of Iran Fara Bourse.,2013,دستورالعمل اجرايي نحوه انجام معاملات اوراق بهادار در بازار پايه فرابورس,/Users/rohamhosseini/Documents/scraper simple/laws_clean/Aeen-Nameh/دستورالعمل_اجرايي_نحوه_انجام_معاملات_اوراق_بهادار_در_بازار_پايه_فرابورس_8708676630394528682.txt
2fc63c305367,minor,banking_money|commodities|prices,Directive on futures contract trading at the Iran Mercantile (commodity) Exchange.,2008,دستورالعمل اجرايي معاملات قراردادهاي آتي در شركت بورس كالاي ايران  سهامي عام,/Users/rohamhosseini/Documents/scraper simple/laws_clean/Aeen-Nameh/دستورالعمل_اجرايي_معاملات_قراردادهاي_آتي_در_شركت_بورس_كالاي_ايران__سهامي_عام__13436639759876987412.txt
b0bdca32c919,minor,energy|banking_money,Directive on commodity/securities trading at the Iran Energy Exchange.,2012,دستورالعمل معاملات كالا و اوراق بهادار مبتني بر  كالا در بورس انرژي,/Users/rohamhosseini/Documents/scraper simple/laws_clean/Aeen-Nameh/دستورالعمل_معاملات_كالا_و_اوراق_بهادار_مبتني_بر__كالا_در_بورس_انرژي_3094041737662974064.txt
9ae5fb769368,minor,fx,"Rules setting foreign-currency allocation for government officials traveling abroad, a minor FX-rationing instrument.",1994,ضوابط  تعيين ارز مورد نياز مامورين اعزامي به خارج از كشور,/Users/rohamhosseini/Documents/scraper simple/laws_clean/Aeen-Nameh/ضوابط__تعيين_ارز_مورد_نياز_مامورين_اعزامي_به_خارج_از_كشور_11937460554162253663.txt
ea834e0f1618,minor,oil_gas,"Authorizes implementation of agreement with crude oil buyer companies, touching oil export terms.",1971,قانون اجازه اجراي موافقت نامه ايران با شركتهاي خريدار نفت خام,/Users/rohamhosseini/Documents/scraper simple/laws_clean/general_laws/قانون_اجازه_اجراي_موافقت_نامه_ايران_با_شركتهاي_خريدار_نفت_خام_13813531494730244607.txt
d4aa4a39dd64,minor,banking_money|agriculture,"Amends Agricultural Bank of Iran charter article, a state bank instrument for farm credit.",1968,قانون اصلاح ماده 9 اساسنامه بانك كشاورزي ايران,/Users/rohamhosseini/Documents/scraper simple/laws_clean/general_laws/قانون_اصلاح_ماده_9_اساسنامه_بانك_كشاورزي_ايران_4670350287937620784.txt
12f28b031c6c,moderate,agriculture,"Amends nationalization-of-water law, affecting agricultural water allocation/regulation.",1976,قانون اصلاح تبصره ماده 29 قانون آب و نحوه ملي شدن آن,/Users/rohamhosseini/Documents/scraper simple/laws_clean/general_laws/قانون_اصلاح_تبصره_ماده_29_قانون_آب_و_نحوه_ملي_شدن_آن_2152541666792308435.txt
18261a5450b0,minor,customs_trade,"Customs duty exemption for sheet glass, a tariff instrument.",1978,قانون معافيت حقوق گمركي شيشه جام,/Users/rohamhosseini/Documents/scraper simple/laws_clean/general_laws/قانون_معافيت_حقوق_گمركي_شيشه_جام_16002373618709548715.txt
964efda00e7a,minor,housing|banking_money,"Sets maximum housing loan amount, a housing credit instrument.",1980,لايحه قانوني راجع به تعيين حداكثرمبلغ وام مسكن,/Users/rohamhosseini/Documents/scraper simple/laws_clean/general_laws/لايحه_قانوني_راجع_به_تعيين_حداكثرمبلغ_وام_مسكن_974928460475459323.txt
206c8c4e3b73,minor,housing|banking_money,Loan fee terms for a large housing fund loan to Housing Foundation.,1979,لایحه قانونی راجع به کارمزد وام پانصد میلیون ریالی که وزارت مسکن و شهرسازی [وزارت راه و شهرسازی] در اختیار بنیاد مسکن انقلاب اسلامی قرار داده است با اصلاحات و الحاقات بعدی,/Users/rohamhosseini/Documents/scraper simple/laws_clean/general_laws/14378321208560016626_14378321208560016626.txt
bf424dc5c8ec,minor,customs_trade,Adds a note to executive bylaw of import/export regulations law.,1991,تصويبنامه راجع به الحاق يك تبصره بماده 36 آئيننامه اجرائي قانون مقررات صادرات و واردات,/Users/rohamhosseini/Documents/scraper simple/laws_clean/Aeen-Nameh/تصويبنامه_راجع_به_الحاق_يك_تبصره_بماده_36_آئيننامه_اجرائي_قانون_مقررات_صادرات_و_واردات_11663505943604438870.txt
37b2b3554a6c,minor,agriculture,"Amends bylaw for compensating drought damage/duties, an agricultural relief instrument.",2002,اصلاح  آيين نامه  اجرايي  قانون  جبران  خسارت  و پيشگيري  عوارض  ناشي از خشكسالي,/Users/rohamhosseini/Documents/scraper simple/laws_clean/Aeen-Nameh/اصلاح__آيين_نامه__اجرايي__قانون__جبران__خسارت__و_پيشگيري__عوارض__ناشي_از_خشكسالي_6386587664295750718.txt
c51647482dfa,minor,customs_trade,Amendment to executive bylaw of import/export regulations law.,1999,اصلاحيه آيين نامه اجرايي قانون مقررات صادرات و واردات,/Users/rohamhosseini/Documents/scraper simple/laws_clean/Aeen-Nameh/اصلاحيه_آيين_نامه_اجرايي_قانون_مقررات_صادرات_و_واردات_17392190752783186438.txt
e9108dd0739e,minor,privatization,"Decree on share pricing/discount methods for buyers, relates to privatization sale terms.",2003,تصويب نامه راجع به شيوه هاي قيمت گذاري سهام، تخفيف ها و چگونگي پرداخت قيمت توسط خريداران,/Users/rohamhosseini/Documents/scraper simple/laws_clean/Aeen-Nameh/تصويب_نامه_راجع_به_شيوه_هاي_قيمت_گذاري_سهام،_تخفيف_ها_و_چگونگي_پرداخت_قيمت_توسط_خريداران_17268093246240422572.txt
6d13a46158c8,minor,customs_trade,Amendment to import/export regulations bylaw article.,1999,نامه اصلاحي اصلاحيه ماده  15  آيين نامه اجرايي قانون مقررات صادرات و واردات,/Users/rohamhosseini/Documents/scraper simple/laws_clean/Aeen-Nameh/نامه_اصلاحي_اصلاحيه_ماده__15__آيين_نامه_اجرايي_قانون_مقررات_صادرات_و_واردات_2673925943814681933.txt
f76c85fc8370,minor,mining,Amends bylaw for sale of minerals and mine extraction/sale by private sector.,1985,اصلاح آيين نامه فروش مواد معدني و آيين نامه استخراج و فروش معادن توسط  بخش خصوصي,/Users/rohamhosseini/Documents/scraper simple/laws_clean/Aeen-Nameh/اصلاح_آيين_نامه_فروش_مواد_معدني_و_آيين_نامه_استخراج_و_فروش_معادن_توسط__بخش_خصوصي_14507992683494130323.txt
614012d03a2c,minor,customs_trade,Amends import/export regulations bylaw articles.,1989,تصويبنامه راجع به اصلاح مواد 35و 36 و 52 آئيننامه قانون مقررات صادرات و واردات,/Users/rohamhosseini/Documents/scraper simple/laws_clean/Aeen-Nameh/تصويبنامه_راجع_به_اصلاح_مواد_35و_36_و_52_آئيننامه_قانون_مقررات_صادرات_و_واردات_11163391094761714138.txt
e68a685a4fa8,minor,customs_trade,"Bylaw for selling smuggled/confiscated goods, affects trade enforcement revenue.",1995,آيين  نامه اجرايي نحوه فروش كالاهاي قاچا ... ز، مصوب 1374 2 12 مجمع  تشخيص مصلحت نظام,/Users/rohamhosseini/Documents/scraper simple/laws_clean/Aeen-Nameh/آيين__نامه_اجرايي_نحوه_فروش_كالاهاي_قاچا_..._ز،_مصوب_1374_2_12_مجمع__تشخيص_مصلحت_نظام_13554489908209533006.txt
c46bd45c6d28,minor,budget_fiscal,Executive bylaw for a budget-law clause item.,2000,آيين نامه اجرايي جز  2  بند   الف  و بند ... بصره  4    قانون بودجه سال 1379 كل كشورر,/Users/rohamhosseini/Documents/scraper simple/laws_clean/Aeen-Nameh/آيين_نامه_اجرايي_جز__2__بند___الف__و_بند_..._بصره__4____قانون_بودجه_سال_1379_كل_كشورر_7726217364339182372.txt
4ef50ec752e2,minor,mining,Adds a note to mining law's executive bylaw article 118.,2017,الحاق يك تبصره به ماده  118  آيين نامه اجرايي قانون معادن,/Users/rohamhosseini/Documents/scraper simple/laws_clean/Aeen-Nameh/الحاق_يك_تبصره_به_ماده__118__آيين_نامه_اجرايي_قانون_معادن_8957333832483025507.txt
b7d54a5d4130,minor,customs_trade,Executive bylaw for budget clause tied to import/export item.,2003,آيين نامه اجرايي جزﺀ  4  بند  ب  تبصره  4  قانون بودجه سال 1382 كل كشور,/Users/rohamhosseini/Documents/scraper simple/laws_clean/Aeen-Nameh/آيين_نامه_اجرايي_جزﺀ__4__بند__ب__تبصره__4__قانون_بودجه_سال_1382_كل_كشور_15502393956723204680.txt
16ae6c87b634,minor,customs_trade,Amendment to import/export regulations bylaw.,2001,اصلاحيه آيين  نامه اجرايي قانون مقررات صادرات و واردات,/Users/rohamhosseini/Documents/scraper simple/laws_clean/Aeen-Nameh/اصلاحيه_آيين__نامه_اجرايي_قانون_مقررات_صادرات_و_واردات_4439965939022802278.txt
c1c3f6936dfc,minor,customs_trade,Adds article to import/export regulations bylaw.,1994,الحاق ماده  47  به آيين نامه اجرايي مقررات صادرات و واردات,/Users/rohamhosseini/Documents/scraper simple/laws_clean/Aeen-Nameh/الحاق_ماده__47__به_آيين_نامه_اجرايي_مقررات_صادرات_و_واردات_2259084984506080325.txt
16ff8da9aeab,moderate,taxation,"Executive bylaw for national reconstruction cooperation tax law, a tax instrument.",1989,آئين نامه  اجرايي  قانون  ماليات  تعاون  ملي  براي  بازسازي  مصوب 1367 12 9,/Users/rohamhosseini/Documents/scraper simple/laws_clean/Aeen-Nameh/آئين_نامه__اجرايي__قانون__ماليات__تعاون__ملي__براي__بازسازي__مصوب_1367_12_9_16129715521463374011.txt
3755a5bfe746,minor,banking_money,"Directive on professional qualification of financial institution managers, capital market governance.",2011,دستورالعمل تاييد صلاحيت حرفه اي مديران نهادهاي مالي,/Users/rohamhosseini/Documents/scraper simple/laws_clean/Aeen-Nameh/دستورالعمل_تاييد_صلاحيت_حرفه_اي_مديران_نهادهاي_مالي_5495528035539851128.txt
