law_id,importance,domains,why,year,title_fa,path
e705e648c9bf,moderate,customs_trade,Law on calculating/collecting customs duties for imported vs domestic-made vehicles/parts — direct tariff instrument.,1992,قانون چگونگي محاسبه و وصول حقوق گمركي، س ... راهسازي وارداتي و ساخت داخل و قطعات آنها,/Users/rohamhosseini/Documents/scraper simple/laws_clean/general_laws/قانون_چگونگي_محاسبه_و_وصول_حقوق_گمركي،_س_..._راهسازي_وارداتي_و_ساخت_داخل_و_قطعات_آنها_3489923977457885212.txt
17f9e848a44a,major,banking_money,1979 nationalization law of insurance and credit institutions — headline financial-sector nationalization.,1979,لايحه قانون ملي شدن موسسات بيمه و موسسات اعتباري,/Users/rohamhosseini/Documents/scraper simple/laws_clean/general_laws/لايحه_قانون_ملي_شدن_موسسات_بيمه_و_موسسات_اعتباري_6471832425163657477.txt
a01eb6397103,major,oil_gas,1951 oil nationalization implementation bill — foundational national economic policy.,1951,طرح قانوني دائر بطرز اجراي اصل ملي شدن صنعت نفت در سراسر كشور,/Users/rohamhosseini/Documents/scraper simple/laws_clean/general_laws/طرح_قانوني_دائر_بطرز_اجراي_اصل_ملي_شدن_صنعت_نفت_در_سراسر_كشور_12525942898480863707.txt
254385da25e0,minor,budget_fiscal,Annual national budget law (1344) sets government spending/revenue.,1965,قانون بودجه سال 1344 كل كشور,/Users/rohamhosseini/Documents/scraper simple/laws_clean/general_laws/قانون_بودجه_سال_1344_كل_كشور_3977129219901237580.txt
48ba5ed2d771,minor,budget_fiscal,Annual national budget law (1375).,1996,قانون بودجه سال 1375 كل كشور,/Users/rohamhosseini/Documents/scraper simple/laws_clean/general_laws/قانون_بودجه_سال_1375_كل_كشور_739102160062214243.txt
5572cb5be4c4,moderate,budget_fiscal,Law distributing 30 billion rial across development/current budgets and loan repayments.,1974,قانون نحوه توزيع سي ميليارد 30000000000  ... نامه هاي عمراني و جاري و بازپرداخت وامها,/Users/rohamhosseini/Documents/scraper simple/laws_clean/general_laws/قانون_نحوه_توزيع_سي_ميليارد_30000000000__..._نامه_هاي_عمراني_و_جاري_و_بازپرداخت_وامها_7464091114093015535.txt
70834a700034,moderate,banking_money,Law on powers of the Industrial Credit Bank — shapes industrial credit allocation.,1971,قانون اختيارات بانك اعتبارات صنعتي,/Users/rohamhosseini/Documents/scraper simple/laws_clean/general_laws/قانون_اختيارات_بانك_اعتبارات_صنعتي_5006660304420791075.txt
bf635923cb31,moderate,agriculture,Bill addressing problems of agricultural joint-stock companies/production cooperatives — affects farm output organization.,1980,لايحه قانوني راجع به رفع مشكلات مربوط به ... اي سهامي زراعي و تعاونيهاي توليد روستائي,/Users/rohamhosseini/Documents/scraper simple/laws_clean/general_laws/لايحه_قانوني_راجع_به_رفع_مشكلات_مربوط_به_..._اي_سهامي_زراعي_و_تعاونيهاي_توليد_روستائي_12853029137413453685.txt
4b2212efe1c8,moderate,agriculture|housing,Law determining status of cultivated lands/structures on crown (khaliseh) lands — land reform instrument.,1975,قانون تعيين تكليف اراضي مزروعي و اعيان مستحدث از طرف اشخاص در دهات و مزارع خالصه,/Users/rohamhosseini/Documents/scraper simple/laws_clean/general_laws/قانون_تعيين_تكليف_اراضي_مزروعي_و_اعيان_مستحدث_از_طرف_اشخاص_در_دهات_و_مزارع_خالصه_6925798666984715077.txt
b9fe487f2bd0,moderate,agriculture,Law on protection/exploitation of forests and rangelands — regulates a natural-resource economic input.,1967,قانون حفاظت و بهره   برداري از جنگلها و مراتع,/Users/rohamhosseini/Documents/scraper simple/laws_clean/general_laws/قانون_حفاظت_و_بهره___برداري_از_جنگلها_و_مراتع_2746259939847080675.txt
02783f921a13,major,housing,Urban Land Law (1987) — major land/housing policy affecting land supply and housing prices.,1987,قانون زمين شهري,/Users/rohamhosseini/Documents/scraper simple/laws_clean/general_laws/قانون_زمين_شهري_14748031078579790898.txt
a9589c1fa09f,minor,agriculture,Law on preventing drought damages and compensation — has fiscal/compensation instrument affecting agriculture output.,2001,قانون پيشگيري از عوارض ناشي از خشكسالي و جبران خسارات,/Users/rohamhosseini/Documents/scraper simple/laws_clean/general_laws/قانون_پيشگيري_از_عوارض_ناشي_از_خشكسالي_و_جبران_خسارات_7003960586148571447.txt
623505d51313,moderate,agriculture|privatization,Law on sale of crown lands (khalisejat) and agricultural/industrial bonds — land privatization and credit instrument.,1934,قانون راجع به فروش خالصجات و قرضه هاي فلاحتي و صنعتي,/Users/rohamhosseini/Documents/scraper simple/laws_clean/general_laws/قانون_راجع_به_فروش_خالصجات_و_قرضه_هاي_فلاحتي_و_صنعتي_6832530461518469301.txt
19134a80777a,moderate,energy,Law establishing Iran's national electricity organization — shapes power-sector production/pricing.,1967,قانون  سازمان  برق  ايران,/Users/rohamhosseini/Documents/scraper simple/laws_clean/general_laws/قانون__سازمان__برق__ايران_3083103430619713532.txt
169408e64fad,major,agriculture,Law on division and sale of leased farmland to tenant farmers — classic land reform affecting agricultural production/ownership.,1969,قانون تقسیم و فروش املاک مورد اجاره بزارعین مستاجر با اصلاحات و الحاقات بعدی,/Users/rohamhosseini/Documents/scraper simple/laws_clean/general_laws/9630085646541449275_9630085646541449275.txt
b12ba31416a4,minor,budget_fiscal,Implementing bylaw for a budget-law clause — narrow fiscal instrument.,2006,آيين نامه اجرايي بند  15  تبصره  2  قانون بودجه سال 1385 كل كشور,/Users/rohamhosseini/Documents/scraper simple/laws_clean/Aeen-Nameh/آيين_نامه_اجرايي_بند__15__تبصره__2__قانون_بودجه_سال_1385_كل_كشور_15641497212702863632.txt
8ebf737ce68f,minor,customs_trade,Amendment adding a note to import/export regulations bylaw — trade instrument tweak.,2014,الحاق تبصره به بند  2  ماده  10  آيين نامه اجرايي قانون مقررات صادرات و واردات,/Users/rohamhosseini/Documents/scraper simple/laws_clean/Aeen-Nameh/الحاق_تبصره_به_بند__2__ماده__10__آيين_نامه_اجرايي_قانون_مقررات_صادرات_و_واردات_424123100945393656.txt
d8b4dd8686d1,minor,customs_trade,Amendment to import/export regulations implementing bylaw.,2015,اصلاح ماده  11  آيين نامه اجرايي قانون مقررات صادرات و واردات,/Users/rohamhosseini/Documents/scraper simple/laws_clean/Aeen-Nameh/اصلاح_ماده__11__آيين_نامه_اجرايي_قانون_مقررات_صادرات_و_واردات_5166512543779858111.txt
cebabe4313ae,minor,budget_fiscal,Budget-law clause implementing bylaw.,2004,آيين نامه اجرايي بند  الف  تبصره  20  قانون بودجه سال 1383 كل كشور,/Users/rohamhosseini/Documents/scraper simple/laws_clean/Aeen-Nameh/آيين_نامه_اجرايي_بند__الف__تبصره__20__قانون_بودجه_سال_1383_كل_كشور_4590574716997632899.txt
b1d60a8a1599,moderate,industry,Bylaw implementing law on improving quality of domestic auto/industrial production — industrial policy instrument.,2010,آيين نامه اجرايي قانون ارتقاء كيفي توليد خودرو و ساير توليدات صنعتي داخلي,/Users/rohamhosseini/Documents/scraper simple/laws_clean/Aeen-Nameh/آيين_نامه_اجرايي_قانون_ارتقاء_كيفي_توليد_خودرو_و_ساير_توليدات_صنعتي_داخلي_9456766416223505608.txt
e0dad07bfe57,minor,agriculture,Bylaw implementing agriculture ministry formation law article — administrative but touches ag policy execution.,2008,آيين نامه اجرايي ماده  11  قانون تشكيل وزارت جهاد كشاورزي   مصوب 1379,/Users/rohamhosseini/Documents/scraper simple/laws_clean/Aeen-Nameh/آيين_نامه_اجرايي_ماده__11__قانون_تشكيل_وزارت_جهاد_كشاورزي___مصوب_1379___18012823514481694102.txt
9151a41dbfc8,minor,budget_fiscal,Bylaw implementing Fifth Development Plan clause.,2013,آيين نامه اجرايي بند  د  ماده  32  قانون برنامه پنجساله پنجم توسعه جمهوري اسلامي ايران,/Users/rohamhosseini/Documents/scraper simple/laws_clean/Aeen-Nameh/آيين_نامه_اجرايي_بند__د__ماده__32__قانون_برنامه_پنجساله_پنجم_توسعه_جمهوري_اسلامي_ايران_9586238414337093918.txt
154647eb926b,minor,customs_trade|taxation,Amendment to tariff/duty (عوارض) collection procedure in free trade-industrial zones.,1996,اصلاح تصويبنامه دستورالعمل و روش اجرائي آئين نامه اخذ عوارض در مناطق آزاد تجاري - صنعتي,/Users/rohamhosseini/Documents/scraper simple/laws_clean/Aeen-Nameh/اصلاح_تصويبنامه_دستورالعمل_و_روش_اجرائي_آئين_نامه_اخذ_عوارض_در_مناطق_آزاد_تجاري_-_صنعتي_16943020053571238.txt
29a699213348,moderate,agriculture,Bylaw implementing law on increasing agricultural sector productivity — real ag policy instrument.,2012,آيين نامه اجرايي ماده  33  قانون افزايش بهره وري بخش كشاورزي و منابع طبيعي,/Users/rohamhosseini/Documents/scraper simple/laws_clean/Aeen-Nameh/آيين_نامه_اجرايي_ماده__33__قانون_افزايش_بهره_وري_بخش_كشاورزي_و_منابع_طبيعي_5960329854997799828.txt
bcc015061b59,minor,customs_trade,Financial/transaction bylaw for free trade-industrial zone organizations.,2021,آيين نامه مالي و معاملاتي سازمانهاي مناطق آزاد تجاري - صنعتي,/Users/rohamhosseini/Documents/scraper simple/laws_clean/Aeen-Nameh/آيين_نامه_مالي_و_معاملاتي_سازمانهاي_مناطق_آزاد_تجاري_-_صنعتي_8428565048002600893.txt
d29a2414b309,minor,budget_fiscal,Budget-clause implementing bylaw.,1987,آيين نامه اجرايي تبصره 13 قانون بودجه سال 1366,/Users/rohamhosseini/Documents/scraper simple/laws_clean/Aeen-Nameh/_آيين_نامه_اجرايي_تبصره_13_قانون_بودجه_سال_1366_7080090943692673959.txt
a7f190d457ec,minor,budget_fiscal,Budget-clause implementing bylaw.,2004,آيين نامه اجرايي بند  ث  تبصره  12  قانون بودجه سال 1383 كل كشور,/Users/rohamhosseini/Documents/scraper simple/laws_clean/Aeen-Nameh/آيين_نامه_اجرايي_بند__ث__تبصره__12__قانون_بودجه_سال_1383_كل_كشور_4305785804889386716.txt
d2f64b219a44,moderate,banking_money,Policy-supervisory rules for the national banking network — affects credit/monetary conditions.,2008,ضوابط سياستي - نظارتي شبكه بانكي كشور,/Users/rohamhosseini/Documents/scraper simple/laws_clean/Aeen-Nameh/ضوابط_سياستي_-_نظارتي_شبكه_بانكي_كشور_12208405519519593478.txt
0fbc04ca25cc,minor,housing,Amendment to bylaw on housing production/supply support law — housing supply instrument.,2012,اصلاح تبصره  1  ماده  7  آيين  نامه اجرا ... ن ساماندهي و حمايت از توليد و عرضه مسكن,/Users/rohamhosseini/Documents/scraper simple/laws_clean/Aeen-Nameh/اصلاح_تبصره__1__ماده__7__آيين__نامه_اجرا_..._ن_ساماندهي_و_حمايت_از_توليد_و_عرضه_مسكن__10882355465250143122.txt
2eb6a0f910c6,minor,customs_trade|taxation,Amendment to duty (عوارض) collection decree in free trade zones.,2015,اصلاح تصويب نامه شماره 39311  ت50410ك مو ... مه اخذ عوارض در مناطق آزاد تجاري - صنعتي,/Users/rohamhosseini/Documents/scraper simple/laws_clean/Aeen-Nameh/اصلاح_تصويب_نامه_شماره_39311__ت50410ك_مو_..._مه_اخذ_عوارض_در_مناطق_آزاد_تجاري_-_صنعتي_9631723304724178333.txt
30c0f1bd23ba,minor,budget_fiscal,Annual current-budget implementing rules.,1999,ضوابط اجرايي بودجه جاري سال 1378 كل كشور,/Users/rohamhosseini/Documents/scraper simple/laws_clean/Aeen-Nameh/ضوابط_اجرايي_بودجه_جاري_سال_1378_كل_كشور_3402074550890812377.txt
2ef22f362cb2,minor,budget_fiscal,Budget-clause implementing bylaw.,1989,آئين نامه اجرائي بند ج  تبصره 13 قانون بودجه سال 1368,/Users/rohamhosseini/Documents/scraper simple/laws_clean/Aeen-Nameh/آئين_نامه_اجرائي_بند_ج__تبصره_13_قانون_بودجه_سال_1368_6754107488560647976.txt
8eb59ed0c1ff,minor,budget_fiscal,Budget-clause implementing bylaw.,1991,آئين نامه  اجرايي  تبصره  4 قانون  بودجه  سال  1370 كل  كشور,/Users/rohamhosseini/Documents/scraper simple/laws_clean/Aeen-Nameh/آئين_نامه__اجرايي__تبصره__4_قانون__بودجه__سال__1370_كل__كشور_16683540973806680494.txt
2cf4efee3349,moderate,fx|banking_money,Bylaw on establishing stock exchange operations in free trade-industrial zones — capital market instrument.,2019,آيين نامه تأسيس و فعاليت بورس در مناطق آزاد تجاري - صنعتي جمهوري اسلامي ايران,/Users/rohamhosseini/Documents/scraper simple/laws_clean/Aeen-Nameh/آيين_نامه_تأسيس_و_فعاليت_بورس_در_مناطق_آزاد_تجاري_-_صنعتي_جمهوري_اسلامي_ايران_4312926141625237562.txt
793ca174fc40,minor,budget_fiscal,Budget-clause implementing bylaw.,2006,آيين نامه اجرايي بند  ب   تبصره   6   قانون بودجه سال 1385 كل كشور,/Users/rohamhosseini/Documents/scraper simple/laws_clean/Aeen-Nameh/آيين_نامه_اجرايي_بند__ب___تبصره___6___قانون_بودجه_سال_1385_كل_كشور_7725452321958553455.txt
47cd8a8b44ce,moderate,agriculture|housing,Bylaw implementing law preventing fragmentation of agricultural land — land consolidation affecting farm output.,2009,آيين نامه اجرايي قانون جلوگيري از خرد شدن اراضي كشاورزي و ايجاد قطعات مناسب فني و اقتصادي,/Users/rohamhosseini/Documents/scraper simple/laws_clean/Aeen-Nameh/آيين_نامه_اجرايي_قانون_جلوگيري_از_خرد_شدن_اراضي_كشاورزي_و_ايجاد_قطعات_مناسب_فني_و_اقتصادي_14600755021331626327.txt
9d8c049d54f0,major,privatization,Bylaw implementing Article 44 privatization law article — headline privatization policy instrument.,2009,آيين نامه اجرايي ماده   7   قانون اصلاح  ... سياستهاي كلي اصل چهل و چهارم قانون اساسي,/Users/rohamhosseini/Documents/scraper simple/laws_clean/Aeen-Nameh/آيين_نامه_اجرايي_ماده___7___قانون_اصلاح__..._سياستهاي_كلي_اصل_چهل_و_چهارم_قانون_اساسي_7836293619891643710.txt
66b5f197f4b4,major,privatization,Bylaw implementing Article 44 privatization policy amendment — major privatization instrument.,2014,آيين نامه اجرايي تبصره  5  اصلاحي بند  ا ... اجراي سياست هاي كلي اصل  44  قانون اساسي,/Users/rohamhosseini/Documents/scraper simple/laws_clean/Aeen-Nameh/آيين_نامه_اجرايي_تبصره__5__اصلاحي_بند__ا_..._اجراي_سياست_هاي_كلي_اصل__44__قانون_اساسي_14094834951593849964.txt
1097bb983752,minor,budget_fiscal,Budget-clause implementing bylaw.,2004,آيين نامه اجرايي بند  الف  تبصره  15  قانون بودجه سال 1383 كل كشور,/Users/rohamhosseini/Documents/scraper simple/laws_clean/Aeen-Nameh/آيين_نامه_اجرايي_بند__الف__تبصره__15__قانون_بودجه_سال_1383_كل_كشور_10227075356341605073.txt
1e64d8d17cea,minor,housing,Rural housing improvement implementing instructions under budget note — housing subsidy instrument.,1996,دستورالعمل اجرايي بهسازي مسكن روستايي مو ... يي تبصره 52 قانون بودجه سال 1375 كل كشور,/Users/rohamhosseini/Documents/scraper simple/laws_clean/Aeen-Nameh/دستورالعمل_اجرايي_بهسازي_مسكن_روستايي_مو_..._يي_تبصره_52_قانون_بودجه_سال_1375_كل_كشور_6276037033182286065.txt
61a7cc847066,minor,budget_fiscal,Implementing instructions for a budget-bylaw article.,2006,دستورالعمل اجرايي ماده    5   آيين نامه اجرايي تبصره    13   قانون بودجه سال 1385كل كشور,/Users/rohamhosseini/Documents/scraper simple/laws_clean/Aeen-Nameh/دستورالعمل_اجرايي_ماده____5___آيين_نامه_اجرايي_تبصره____13___قانون_بودجه_سال_1385كل_كشور_2192923714977350441.txt
dee5bf748e79,moderate,industry,Bylaw implementing industrial support law to prevent factory closures — industrial policy instrument.,2018,آيين نامه اجرايي قانون حمايت صنعتي و جلوگيري از تعطيل كارخانه هاي كشور,/Users/rohamhosseini/Documents/scraper simple/laws_clean/Aeen-Nameh/آيين_نامه_اجرايي_قانون_حمايت_صنعتي_و_جلوگيري_از_تعطيل_كارخانه_هاي_كشور_16505523975817843203.txt
f908e10b8d17,moderate,banking_money,Rules governing activity of investment/underwriting companies (تأمين سرمايه) — capital market regulation.,2007,ضوابط فعاليت شركتهاي تأمين سرمايه,/Users/rohamhosseini/Documents/scraper simple/laws_clean/Aeen-Nameh/ضوابط_فعاليت_شركتهاي_تأمين_سرمايه_18150980651432223751.txt
fe8542354221,minor,budget_fiscal,"Annual budget implementing rules, repealing prior decrees on same topic.",1998,ضوابط اجرايي بودجه سال 1377 كل كشور و لغو چند تصويبنامه ي مربوط به اين موضوع,/Users/rohamhosseini/Documents/scraper simple/laws_clean/Aeen-Nameh/ضوابط_اجرايي_بودجه_سال_1377_كل_كشور_و_لغو_چند_تصويبنامه_ي_مربوط_به_اين_موضوع_7399854713825852423.txt
ba511ef75df4,minor,budget_fiscal,Budget-clause implementing bylaw.,2001,آيين نامه اجرايي بند  هـ  تبصره  42  قانون بودجه سال 1380 كل كشور,/Users/rohamhosseini/Documents/scraper simple/laws_clean/Aeen-Nameh/آيين_نامه_اجرايي_بند__هـ__تبصره__42__قانون_بودجه_سال_1380_كل_كشور_12683530048848999301.txt
e430dc4256b1,major,agriculture,"Implementing bylaw for chapter 2 of the Fair Water Distribution Law — governs water allocation, a key agricultural input.",1984,آئین نامه اجرائی فصل دوم - قانون توزیع عادلانه آب با اصلاحات و الحاقات بعدی,/Users/rohamhosseini/Documents/scraper simple/laws_clean/Aeen-Nameh/10199171450659586236_10199171450659586236.txt
687e8e3acc9e,minor,budget_fiscal,Budget-clause implementing bylaw.,1996,آيين نامه اجرايي تبصره 4 قانون بودجه سال 1375 كل كشور,/Users/rohamhosseini/Documents/scraper simple/laws_clean/Aeen-Nameh/آيين_نامه_اجرايي_تبصره_4_قانون_بودجه_سال_1375_كل_كشور_2478365567664690380.txt
e6cf8fb40bff,minor,budget_fiscal,Budget-clause implementing bylaw.,2015,آيين نامه اجرايي بند  ب  تبصره  12  قانون بودجه سال 1394 كل كشور,/Users/rohamhosseini/Documents/scraper simple/laws_clean/Aeen-Nameh/آيين_نامه_اجرايي_بند__ب__تبصره__12__قانون_بودجه_سال_1394_كل_كشور_7424361376553063406.txt
68680546bea4,minor,budget_fiscal,Budget-clause implementing bylaw.,2018,آيين نامه اجرايي بند  هـ  تبصره  10  ماده واحده قانون بودجه سال 1397 كل كشور,/Users/rohamhosseini/Documents/scraper simple/laws_clean/Aeen-Nameh/آيين_نامه_اجرايي_بند__هـ__تبصره__10__ماده_واحده_قانون_بودجه_سال_1397_كل_كشور_10508232228869396670.txt
3225da5d343a,minor,housing|welfare,Housing purchase/construction facilities bylaw for veterans/martyrs' families — housing subsidy instrument.,2016,آيين نامه تسهيلات خريد يا ساخت مسكن آزادگان، جانبازان و خانواده شهدا,/Users/rohamhosseini/Documents/scraper simple/laws_clean/Aeen-Nameh/آيين_نامه_تسهيلات_خريد_يا_ساخت_مسكن_آزادگان،_جانبازان_و_خانواده_شهدا_6852187598161795569.txt
31b32a008317,moderate,industry,Bylaw implementing law on continuous improvement of business environment — business climate/regulatory instrument.,2015,آيين نامه اجرايي ماده  16  قانون بهبود مستمر محيط كسب و كار,/Users/rohamhosseini/Documents/scraper simple/laws_clean/Aeen-Nameh/آيين_نامه_اجرايي_ماده__16__قانون_بهبود_مستمر_محيط_كسب_و_كار_16004668517311016835.txt
cbc3ff978af9,minor,budget_fiscal,Budget-clause implementing bylaw for 1374.,1995,آيين نامه اجرايي تبصره 4 قانون بودجه سال 1374كل كشور,/Users/rohamhosseini/Documents/scraper simple/laws_clean/Aeen-Nameh/آيين_نامه_اجرايي_تبصره_4_قانون_بودجه_سال_1374كل_كشور_13162021169025247643.txt
f8483cf0deed,minor,budget_fiscal,Budget-clause implementing bylaw for 1397.,2018,آيين نامه اجرايي بند  ج  تبصره  4  ماده واحده قانون بودجه سال 1397 كل كشور,/Users/rohamhosseini/Documents/scraper simple/laws_clean/Aeen-Nameh/آيين_نامه_اجرايي_بند__ج__تبصره__4__ماده_واحده_قانون_بودجه_سال_1397_كل_كشور_2305007206595313163.txt
8275d2412687,minor,budget_fiscal,Budget-clause implementing bylaw for 1381.,2002,آيين نامه  اجرايي  بند ي  تبصره  12 قانون  بودجه  سال  1381 كل  كشور,/Users/rohamhosseini/Documents/scraper simple/laws_clean/Aeen-Nameh/آيين_نامه__اجرايي__بند_ي__تبصره__12_قانون__بودجه__سال__1381_كل__كشور_12129861138166880444.txt
35814931b0e9,minor,budget_fiscal,"Implementing instructions for budget bylaw article, 1375.",1996,دستورالعمل اجرايي موضوع ماده 12 آيين نامه اجرايي تبصره 52 قانون بودجه سال 1375 كل كشور,/Users/rohamhosseini/Documents/scraper simple/laws_clean/Aeen-Nameh/دستورالعمل_اجرايي_موضوع_ماده_12_آيين_نامه_اجرايي_تبصره_52_قانون_بودجه_سال_1375_كل_كشور_13087809518628455797.txt
5465c38fb31f,minor,budget_fiscal,Budget-clause implementing bylaw for 1383.,2004,آيين نامه اجرايي بند  چ  تبصره  12  قانون بودجه سال 1383 كل كشور,/Users/rohamhosseini/Documents/scraper simple/laws_clean/Aeen-Nameh/آيين_نامه_اجرايي_بند__چ__تبصره__12__قانون_بودجه_سال_1383_كل_كشور_2654949163168974242.txt
3697dc755648,moderate,banking_money,Regulation on insurance companies' investment rules — shapes insurance-sector capital allocation.,2006,آئين نامه شماره 60 درخصوص سرمايه گذاري مؤسسات بيمه,/Users/rohamhosseini/Documents/scraper simple/laws_clean/Aeen-Nameh/آئين_نامه_شماره_60_درخصوص_سرمايه_گذاري_مؤسسات_بيمه_14898934666272175145.txt
ed519d932ad2,moderate,agriculture|subsidies,Implementing bylaw for budget clause on government's share payment to agricultural insurance fund — ag subsidy instrument.,2025,آيين  نامه اجرايي بند  ب  تبصره  11  قان ... ع پرداخت سهم دولت به صندوق بيمه كشاورزي,/Users/rohamhosseini/Documents/scraper simple/laws_clean/Divan_aali_votes/آيين__نامه_اجرايي_بند__ب__تبصره__11__قان_..._ع_پرداخت_سهم_دولت_به_صندوق_بيمه_كشاورزي__14016079820386346651.txt
