law_id,importance,domains,why,year,title_fa,path
e7060f9cef77,moderate,privatization|prices,Bylaw on pricing methods for state enterprises subject to privatization,2009,آيين نامه اجرايي شيوه هاي قيمت گذاري بنگاه ها و نحوه اعمال شيوه ها ي مذكور در همين چارچوب,/Users/rohamhosseini/Documents/scraper simple/laws_clean/Aeen-Nameh/آيين_نامه_اجرايي_شيوه_هاي_قيمت_گذاري_بنگاه_ها_و_نحوه_اعمال_شيوه_ها_ي_مذكور_در_همين_چارچوب_1242606394335590093.txt
b2316d0a7016,minor,customs_trade|budget_fiscal,Duplicate: customs circular implementing 1404 budget law trade provisions,,بخشنامه گمرك در خصوص ابلاغ احكام قانون بودجه سال 1404 كل كشور,/Users/rohamhosseini/Documents/scraper simple/laws_clean/Aeen-Nameh/بخشنامه_گمرك_در_خصوص_ابلاغ_احكام_قانون_بودجه_سال_1404_كل_كشور_5775278626612494259.txt
7b370d923c57,moderate,budget_fiscal,Annual national budget law (1340),1964,قانون بودجه سال 1340 كل كشور,/Users/rohamhosseini/Documents/scraper simple/laws_clean/general_laws/قانون_بودجه_سال_1340_كل_كشور_10366286030941342947.txt
0201f4ad202d,minor,agriculture,Amends forest and rangeland protection/exploitation law,1969,قانون اصلاح قانون حفاظت و بهره برداري از جنگلها و مراتع,/Users/rohamhosseini/Documents/scraper simple/laws_clean/general_laws/قانون_اصلاح_قانون_حفاظت_و_بهره_برداري_از_جنگلها_و_مراتع_5981459572084783114.txt
6b6b4c57946c,moderate,budget_fiscal,Annual national budget (1352),1973,بودجه سال 1352 كل كشور,/Users/rohamhosseini/Documents/scraper simple/laws_clean/general_laws/بودجه_سال_1352_كل_كشور_10756657757736159574.txt
f8687969283a,moderate,budget_fiscal,Annual national budget law (1342),1964,قانون بودجه سال 1342,/Users/rohamhosseini/Documents/scraper simple/laws_clean/general_laws/قانون_بودجه_سال_1342___6441246097426192966.txt
620d5f795606,minor,customs_trade,Iran-Afghanistan trade agreement law,2004,قانون موافقتنامه بازرگاني بين دولت جمهوري اسلامي ايران و دولت انتقالي اسلامي افغانستان,/Users/rohamhosseini/Documents/scraper simple/laws_clean/general_laws/قانون_موافقتنامه_بازرگاني_بين_دولت_جمهوري_اسلامي_ايران_و_دولت_انتقالي_اسلامي_افغانستان_849503983983617781.txt
4a4ccdb522da,major,taxation,Amendment to Direct Taxation Law provisions,1992,قانون اصلاح موادي از قانون مالياتهاي مستقيم مصوب سوم اسفند ماه 1366 مجلس شوراي اسلامي,/Users/rohamhosseini/Documents/scraper simple/laws_clean/general_laws/قانون_اصلاح_موادي_از_قانون_مالياتهاي_مستقيم_مصوب_سوم_اسفند_ماه_1366_مجلس_شوراي_اسلامي_9466592529241234623.txt
866b8e1f11b2,moderate,budget_fiscal,Annual national budget law (1387),2008,قانون بودجه سال 1387 كل كشور,/Users/rohamhosseini/Documents/scraper simple/laws_clean/general_laws/قانون_بودجه_سال_1387_كل_كشور_2818836633449522459.txt
f3b9c700962f,moderate,industry|budget_fiscal,Bylaw on competitive production and financial system improvement law,2015,آيين نامه اجرايي بند  الف  ماده  9  قانو ... توليد رقابت پذير و ارتقاي نظام مالي كشور,/Users/rohamhosseini/Documents/scraper simple/laws_clean/Aeen-Nameh/آيين_نامه_اجرايي_بند__الف__ماده__9__قانو_..._توليد_رقابت_پذير_و_ارتقاي_نظام_مالي_كشور_13956278852232316958.txt
0ad2830a4079,moderate,housing,National sustainable urban regeneration program bylaw,2018,آيين نامه اجرايي برنامه ملي بازآفريني شهري پايدار,/Users/rohamhosseini/Documents/scraper simple/laws_clean/Aeen-Nameh/آيين_نامه_اجرايي_برنامه_ملي_بازآفريني_شهري_پايدار_14607384583198394849.txt
9d11f0b92e24,minor,energy|prices,"Bylaw on penalties for unauthorized water/electricity/gas/telephone use, utility pricing enforcement",2018,آيين نامه اجرايي قانون مجازات استفاده كنندگان غيرمجاز از آب، برق ، تلفن، فاضلاب و گاز,/Users/rohamhosseini/Documents/scraper simple/laws_clean/Aeen-Nameh/آيين_نامه_اجرايي_قانون_مجازات_استفاده_كنندگان_غيرمجاز_از_آب،_برق_،_تلفن،_فاضلاب_و_گاز_10913883195871497547.txt
a879a7e5283f,minor,housing,Bylaw on transaction rules for Housing Foundation of Islamic Revolution,2016,تصويبنامه شماره 2624 ص مورخ 11  5  1395 راجع به آيين نامه معاملات بنياد مسكن انقلاب اسلامي,/Users/rohamhosseini/Documents/scraper simple/laws_clean/Aeen-Nameh/تصويبنامه_شماره_2624_ص_مورخ_11__5__1395_راجع_به_آيين_نامه_معاملات_بنياد_مسكن_انقلاب_اسلامي_4210059917218712301.txt
857f5c3efe3f,moderate,privatization|prices,Bylaw on pricing methods for state enterprises subject to privatization (variant),2005,آيين  نامه اجرايي شيوه  هاي قيمت  گذاري  ... فرهنگي جمهوري اسلامي ايران ـ مصوب 1383 ـ,/Users/rohamhosseini/Documents/scraper simple/laws_clean/Aeen-Nameh/آيين__نامه_اجرايي_شيوه__هاي_قيمت__گذاري__..._فرهنگي_جمهوري_اسلامي_ايران_ـ_مصوب_1383_ـ_16616140740437628963.txt
2c7cce6163b0,moderate,privatization,Bylaw on stock exchange offering conditions for privatized companies,2007,آيين نامه شرايط عرضه سهام شركت هاي مشمول واگذاري در بورس يا بازار خارج از بورس,/Users/rohamhosseini/Documents/scraper simple/laws_clean/Aeen-Nameh/آيين_نامه_شرايط_عرضه_سهام_شركت_هاي_مشمول_واگذاري_در_بورس_يا_بازار_خارج_از_بورس_16187039247558169745.txt
76bad6fd14a4,moderate,energy,Bylaw implementing Energy Consumption Pattern Reform Law provision,2015,آيين نامه اجرايي ماده  17  قانون اصلاح الگوي مصرف انرژي,/Users/rohamhosseini/Documents/scraper simple/laws_clean/Aeen-Nameh/آيين_نامه_اجرايي_ماده__17__قانون_اصلاح_الگوي_مصرف_انرژي_8980111746361944360.txt
a152516ceaf0,minor,customs_trade,Adds technical standards articles to car import bylaw,2017,الحاق مواد  13 ،  14 ،  15 ،  16 ، و  17  به آيين نامه ضوابط فني واردات خودرو,/Users/rohamhosseini/Documents/scraper simple/laws_clean/Aeen-Nameh/الحاق_مواد__13_،__14_،__15_،__16_،_و__17__به_آيين_نامه_ضوابط_فني_واردات_خودرو_4830824959922117809.txt
8caf0604f9aa,moderate,privatization,Bylaw on pricing state-owned shares for divestment,2008,آيين نامه اجرايي قيمت گذاري سهام متعلق ب ... فيفها و چگونگي پرداخت قيمت توسط خريداران,/Users/rohamhosseini/Documents/scraper simple/laws_clean/Aeen-Nameh/آيين_نامه_اجرايي_قيمت_گذاري_سهام_متعلق_ب_..._فيفها_و_چگونگي_پرداخت_قيمت_توسط_خريداران_16944559596118583317.txt
23c49d04deb8,major,customs_trade,Amends commercial profit rates and tariff sub-headings for export/import schedules,2002,اصلاح  سود بازرگاني  و زيرنويس  تعرفه ها ...   صادرات  و واردات  به  شرح جداول  پيوست,/Users/rohamhosseini/Documents/scraper simple/laws_clean/Aeen-Nameh/اصلاح__سود_بازرگاني__و_زيرنويس__تعرفه_ها_...___صادرات__و_واردات__به__شرح_جداول__پيوست_13691892960614072597.txt
08f5eaa0715f,minor,customs_trade,Ratifies international convention facilitating entry of commercial samples/advertising material,1970,قانون الحاق بقرارداد بين المللي جهت تسهيل ورود نمونه هاي بازرگاني و وسائل تبليغاتي,/Users/rohamhosseini/Documents/scraper simple/laws_clean/general_laws/قانون_الحاق_بقرارداد_بين_المللي_جهت_تسهيل_ورود_نمونه_هاي_بازرگاني_و_وسائل_تبليغاتي_16773495557528627645.txt
892a46bc4b51,moderate,customs_trade,Adds clause to Export/Import Law affecting trade rules,1989,قانون الحاق يك تبصره به ماده 41 قانون صادرات و واردات كشور,/Users/rohamhosseini/Documents/scraper simple/laws_clean/general_laws/قانون_الحاق_يك_تبصره_به_ماده_41_قانون_صادرات_و_واردات_كشور_1713598606848159567.txt
58feb3a2e835,major,agriculture,Land reform law - distribution/sale of leased farmland to tenant farmers,1971,قانون مواد الحاقي بقانون تقسيم و فروش املاك مورد اجاره بزارعين مستاجر  مصوب 23ر10ر1347,/Users/rohamhosseini/Documents/scraper simple/laws_clean/general_laws/قانون_مواد_الحاقي_بقانون_تقسيم_و_فروش_املاك_مورد_اجاره_بزارعين_مستاجر__مصوب_23ر10ر1347_15975116723036582394.txt
434027d4033c,major,banking_money,Usury-free (Islamic) Banking Law - foundational national banking framework,1983,قانون عمليات بانكي بدون ربا   بهره,/Users/rohamhosseini/Documents/scraper simple/laws_clean/general_laws/قانون_عمليات_بانكي_بدون_ربا___بهره__12436796647911528692.txt
64d1aba79eaf,minor,budget_fiscal,Supplementary budget law (1320),1941,قانون متمم بودجه  سال 1320 كشور,/Users/rohamhosseini/Documents/scraper simple/laws_clean/general_laws/قانون_متمم_بودجه__سال_1320_كشور_11280851952448130326.txt
d790cffbaaf2,minor,budget_fiscal,Historic annual national budget law (1319),1940,قانون بودجه كل سال 1319 كشور,/Users/rohamhosseini/Documents/scraper simple/laws_clean/general_laws/قانون_بودجه_كل_سال_1319_كشور_4155003571822094745.txt
2721f4206e69,major,energy|oil_gas,Gas Industry Development Law - core energy sector development instrument,1972,قانون توسعه صنعت گاز,/Users/rohamhosseini/Documents/scraper simple/laws_clean/general_laws/قانون_توسعه_صنعت_گاز_10372982892016868667.txt
6ac2b9b18aa3,minor,budget_fiscal,Increases fourth development plan budget appropriations,1972,قانون افزايش اعتبارات برنامه عمراني چهارم كشور,/Users/rohamhosseini/Documents/scraper simple/laws_clean/general_laws/قانون_افزايش_اعتبارات_برنامه_عمراني_چهارم_كشور_11833530881320267193.txt
4788b64a027c,major,oil_gas,Petroleum Law - foundational national oil sector legislation,1987,قانون نفت,/Users/rohamhosseini/Documents/scraper simple/laws_clean/general_laws/قانون_نفت_4437959238588748802.txt
936caa12d044,moderate,budget_fiscal,Annual national budget law (1321) sets fiscal spending/revenue.,1942,قانون بودجه كل سال 1321 كشور,/Users/rohamhosseini/Documents/scraper simple/laws_clean/general_laws/قانون_بودجه_كل_سال_1321_كشور_1477570950673162566.txt
ce97bf638795,major,budget_fiscal|industry,"5th national development plan, headline multi-year economic program.",1973,خلاصه برنامه پنجم عمراني كشور,/Users/rohamhosseini/Documents/scraper simple/laws_clean/general_laws/خلاصه_برنامه_پنجم_عمراني_كشور_9865755708136317531.txt
a5fe1c03d321,major,budget_fiscal|industry,"4th national development plan, headline multi-year economic program.",1968,قانون برنامه عمراني چهارم كشور,/Users/rohamhosseini/Documents/scraper simple/laws_clean/general_laws/قانون_برنامه_عمراني_چهارم_كشور_7769649028535290152.txt
1230cd960f78,moderate,customs_trade,D-8 preferential trade agreement lowers tariffs among member states.,2007,قانون موافقتنامه تجارت ترجيحي بين كشورهاي عضو  دي  -هشت,/Users/rohamhosseini/Documents/scraper simple/laws_clean/general_laws/قانون_موافقتنامه_تجارت_ترجيحي_بين_كشورهاي_عضو__دي__-هشت_15612471410045438725.txt
fd5c7d2e9443,moderate,subsidies|welfare,Directive for compensatory cash/food-support payments to low-income households.,2018,دستورالعمل بسته پرداخت كمك جبراني و حمايت غذايي از گروه هاي كم درآمد جامعه,/Users/rohamhosseini/Documents/scraper simple/laws_clean/Aeen-Nameh/دستورالعمل_بسته_پرداخت_كمك_جبراني_و_حمايت_غذايي_از_گروه_هاي_كم_درآمد_جامعه_828210585993029469.txt
569c3dbb9be5,moderate,privatization,Implementing bylaw for distribution of Justice Shares (state asset privatization).,2009,آيين نامه اجرايي توزيع سهام عدالت,/Users/rohamhosseini/Documents/scraper simple/laws_clean/Aeen-Nameh/آيين_نامه_اجرايي_توزيع_سهام_عدالت_8719215514030514933.txt
12e5c7953ff4,minor,budget_fiscal,Narrow bylaw allocating a specific 1388 budget credit line.,2009,آيين نامه توزيع اعتبار جزء  6  رديف  520000  قانون بودجه سال 1388 كل كشور,/Users/rohamhosseini/Documents/scraper simple/laws_clean/Aeen-Nameh/آيين_نامه_توزيع_اعتبار_جزء__6__رديف__520000__قانون_بودجه_سال_1388_كل_كشور_16123264101351396291.txt
25626b23075e,major,subsidies,Core implementing bylaw of Article 6 of the Subsidy Targeting Law.,2011,آيين نامه اجرايي ماده   6   قانون هدفمند كردن يارانه ها,/Users/rohamhosseini/Documents/scraper simple/laws_clean/Aeen-Nameh/آيين_نامه_اجرايي_ماده___6___قانون_هدفمند_كردن_يارانه_ها_7811670780858081531.txt
18432ac5265a,moderate,privatization,"Bylaw on transfer of preferential shares, a privatization instrument.",2009,آيين نامه نحوه واگذاري سهام ترجيحي,/Users/rohamhosseini/Documents/scraper simple/laws_clean/Aeen-Nameh/آيين_نامه_نحوه_واگذاري_سهام_ترجيحي_9383271075502295722.txt
159e999dda79,minor,budget_fiscal,Implementing bylaw for a 1396 budget note clause.,2017,آيين نامه اجرايي بندهاي  الف ،  ب ،  ج ، ...  تبصره  16  قانون بودجه سال 1396 كل كشور,/Users/rohamhosseini/Documents/scraper simple/laws_clean/Aeen-Nameh/آيين_نامه_اجرايي_بندهاي__الف_،__ب_،__ج_،_...__تبصره__16__قانون_بودجه_سال_1396_كل_كشور_6064985975792834321.txt
006b94997234,moderate,customs_trade,"Amendment to import/export regulations bylaw, a trade-instrument change.",2011,الحاق ماده  11  مكرر به آيين نامه اجرايي قانون مقررات صادرات و واردات   مصوب 1373 -,/Users/rohamhosseini/Documents/scraper simple/laws_clean/Aeen-Nameh/الحاق_ماده__11__مكرر_به_آيين_نامه_اجرايي_قانون_مقررات_صادرات_و_واردات___مصوب_1373_-_7648832121693990302.txt
78d061997227,minor,budget_fiscal,Implementing bylaw for a specific 1380 budget note clause.,2001,آيين نامه  اجرايي  بند الف  تبصره  27 قانون  بودجه  سال  1380كل  كشور,/Users/rohamhosseini/Documents/scraper simple/laws_clean/Aeen-Nameh/آيين_نامه__اجرايي__بند_الف__تبصره__27_قانون__بودجه__سال__1380كل__كشور_1569265865843331640.txt
7d146990a7cb,minor,budget_fiscal,Implementing bylaw for a specific 1379 budget note clause.,2000,آییننامه اجرایی بند (الف) تبصره (۲۷) قانون بودجه سال ۱۳۷۹ کل کشور با اصلاحات و الحاقات بعدی,/Users/rohamhosseini/Documents/scraper simple/laws_clean/Aeen-Nameh/6835667233505007778_6835667233505007778.txt
d38fb9ca647b,major,industry,"Knowledge-based companies support law, key tech/industry commercialization incentive instrument.",2012,آيين نامه اجرايي قانون حمايت از شركتها و ...  بنيان و تجاري سازي نوآوري ها و اختراعات,/Users/rohamhosseini/Documents/scraper simple/laws_clean/Aeen-Nameh/آيين_نامه_اجرايي_قانون_حمايت_از_شركتها_و_...__بنيان_و_تجاري_سازي_نوآوري_ها_و_اختراعات_5168687951980075898.txt
a39b1be4f482,minor,budget_fiscal,Implementing bylaw for a 1398 budget note clause.,2019,آيين نامه اجرايي بند  هـ   تبصره  7  ماده واحده قانون بودجه سال 1398 كل كشور,/Users/rohamhosseini/Documents/scraper simple/laws_clean/Aeen-Nameh/آيين_نامه_اجرايي_بند__هـ___تبصره__7__ماده_واحده_قانون_بودجه_سال_1398_كل_كشور_5764205590064556719.txt
cb7195602213,moderate,taxation,Court ruling annuls municipal duties (avarez) on contracting agreements.,2012,رأي شماره550 هيأت عمومي ديوان عدالت ادار ... ر خصوص وضع عوارض بر قراردادهاي پيمانكاري,/Users/rohamhosseini/Documents/scraper simple/laws_clean/Divan_edalat_edari_votes/رأي_شماره550_هيأت_عمومي_ديوان_عدالت_ادار_..._ر_خصوص_وضع_عوارض_بر_قراردادهاي_پيمانكاري_8636818724226445711.txt
b09987468ab4,moderate,taxation|prices,Court ruling annuls municipal service-fee tariff for Qom.,2021,راي شماره 1610 هيات عمومي ديوان عدالت اد ...  بهاي خدمات سال 1397 شوراي اسلامي شهر قم,/Users/rohamhosseini/Documents/scraper simple/laws_clean/Divan_edalat_edari_votes/راي_شماره_1610_هيات_عمومي_ديوان_عدالت_اد_...__بهاي_خدمات_سال_1397_شوراي_اسلامي_شهر_قم_13353528152183653065.txt
ca7810dd3eef,moderate,taxation,Court ruling annuls municipal duties/service-fee tariff for Yazd.,2019,رأی شماره ۱۹۶۳ هیأت عمومی دیوان عدالت اداری با موضوع ابطال ماده ۲۲ از تعرفه عوارض و بهای خدمات سال ۱۳۹۴ و ماده ۲۱ از تعرفه عوارض و بهای خدمات سال ۱۳۹۵ مصوب شورای اسلامی شهر یزد با اصلاحات و الحاقات بعدی,/Users/rohamhosseini/Documents/scraper simple/laws_clean/Divan_edalat_edari_votes/13365888895145465528_13365888895145465528.txt
b8f71a32e79b,moderate,taxation,Court ruling on land-related duties (haq-ol-arz).,2016,رأي شماره هاي 358 الي 365 هيأت عمومي ديو ... يب درخصوص تعيين و برقراري عوارض حق الارض,/Users/rohamhosseini/Documents/scraper simple/laws_clean/Divan_edalat_edari_votes/رأي_شماره_هاي_358_الي_365_هيأت_عمومي_ديو_..._يب_درخصوص_تعيين_و_برقراري_عوارض_حق_الارض_15670005225234573008.txt
ebd596328085,moderate,banking_money|taxation,"Court ruling concerns duties/fees on banks, financial institutions and insurance offices.",2017,رأي شماره 685 هيأت عمومي ديوان عدالت ادا ... بانكها، مؤسسات مالي اعتباري و دفاتر بيمه,/Users/rohamhosseini/Documents/scraper simple/laws_clean/Divan_edalat_edari_votes/رأي_شماره_685_هيأت_عمومي_ديوان_عدالت_ادا_..._بانكها،_مؤسسات_مالي_اعتباري_و_دفاتر_بيمه_16775156779996862489.txt
9a24bee1199f,moderate,taxation,Court ruling annuls duties imposed on contractors' activity.,2013,ابطال مصوبات موضوع كدهاي 1311 و 1  1311  ... ر در مورد وضع عوارض بر فعاليت پيمانكاران,/Users/rohamhosseini/Documents/scraper simple/laws_clean/Divan_edalat_edari_votes/ابطال_مصوبات_موضوع_كدهاي_1311_و_1__1311__..._ر_در_مورد_وضع_عوارض_بر_فعاليت_پيمانكاران_5849879049618458577.txt
a4cc71315c8b,moderate,budget_fiscal,Annual national budget law (1368).,1989,قانون  بودجه  سال  1368 كل  كشور,/Users/rohamhosseini/Documents/scraper simple/laws_clean/general_laws/قانون__بودجه__سال__1368_كل__كشور_2157705573082180005.txt
cdb4a87593ab,moderate,agriculture,"Establishes South Iran Fisheries state company, an economic production entity.",1971,قانون تاسيس شركت سهامي شيلات جنوب ايران,/Users/rohamhosseini/Documents/scraper simple/laws_clean/general_laws/قانون_تاسيس_شركت_سهامي_شيلات_جنوب_ايران_9861745147118655234.txt
c019b232b0f6,moderate,agriculture|banking_money,"Amends founding law of Agricultural Development Fund, a credit instrument for farm output.",1968,قانون اصلاح پاره اي از مواد و الحاق مواد جديد بقانون تاسيس صندوق توسعه كشاورزي ايران,/Users/rohamhosseini/Documents/scraper simple/laws_clean/general_laws/قانون_اصلاح_پاره_اي_از_مواد_و_الحاق_مواد_جديد_بقانون_تاسيس_صندوق_توسعه_كشاورزي_ايران_13736275974544720159.txt
1a38f8ae1956,major,industry|privatization,"1979 law on protection/development (nationalization) of Iranian industries, headline post-revolution industrial policy.",1979,قانون حفاظت و توسعه صنايع ايران,/Users/rohamhosseini/Documents/scraper simple/laws_clean/general_laws/قانون_حفاظت_و_توسعه_صنايع_ايران_5095867420606261948.txt
af1bd3d63708,moderate,customs_trade,"Establishes Export Guarantee Fund of Iran, a trade-finance instrument.",1973,قانون  صندوق  ضمانت  صادرات  ايران,/Users/rohamhosseini/Documents/scraper simple/laws_clean/general_laws/قانون__صندوق__ضمانت__صادرات__ايران_13819868193388495592.txt
c62f8027c577,moderate,budget_fiscal,Annual national budget law (1372).,1993,قانون بودجه سال 1372 كل كشور,/Users/rohamhosseini/Documents/scraper simple/laws_clean/general_laws/قانون_بودجه_سال_1372_كل_كشور_3078039171675850391.txt
38fc239469b5,moderate,budget_fiscal,Annual national budget law (1362).,1983,قانون بودجه سال 1362 كل كشور,/Users/rohamhosseini/Documents/scraper simple/laws_clean/general_laws/قانون_بودجه_سال_1362_كل_كشور_16359543413699363050.txt
bebb95fe090e,moderate,budget_fiscal,Amends provisions of the 1359 budget law.,1981,قانون اصلاح بعضي از مقررات قانون بودجه سال 1359,/Users/rohamhosseini/Documents/scraper simple/laws_clean/general_laws/قانون_اصلاح_بعضي_از_مقررات_قانون_بودجه_سال_1359_7175254771953625159.txt
d9810bdf7f5b,moderate,budget_fiscal,Annual national budget law (1363).,1984,قانون بودجه سال 1363 كل كشور,/Users/rohamhosseini/Documents/scraper simple/laws_clean/general_laws/_قانون_بودجه_سال_1363_كل_كشور_4345108776978666515.txt
f70234d3d7cc,moderate,budget_fiscal,Annual national budget law (1367).,1988,قانون بودجه سال 1367 كل كشور,/Users/rohamhosseini/Documents/scraper simple/laws_clean/general_laws/قانون_بودجه_سال_1367_كل_كشور_434822782505970352.txt
f1d74a02b7f1,major,budget_fiscal,"Planning and Budget Organization Law, foundational fiscal-planning statute.",1973,قانون برنامه و بودجه كشور,/Users/rohamhosseini/Documents/scraper simple/laws_clean/general_laws/قانون_برنامه_و_بودجه_كشور_9453652088668195327.txt
8a3c0757369d,moderate,budget_fiscal,Budget bill for 1365.,1986,لايحه بودجه سال 1365 كل كشور,/Users/rohamhosseini/Documents/scraper simple/laws_clean/general_laws/لايحه_بودجه_سال_1365_كل_كشور_14999855369535797407.txt
8e18d08d0b49,moderate,customs_trade,Amends procedure for levying duties in free trade-industrial zones.,2016,اصلاح دستورالعمل و روش اجرايي آيين نامه اخذ عوارض در مناطق آزاد تجاري - صنعتي,/Users/rohamhosseini/Documents/scraper simple/laws_clean/Aeen-Nameh/اصلاح_دستورالعمل_و_روش_اجرايي_آيين_نامه_اخذ_عوارض_در_مناطق_آزاد_تجاري_-_صنعتي_2388848829031661036.txt
2fb080efe212,moderate,taxation|budget_fiscal,"Adds new revenue items per Article 79 of 3rd development plan, a fiscal revenue instrument.",2000,افزايش  عناوين  درآمدهاي  به  شرح  جدول  ...  ماده  79 قانون  برنامه  سوم  توسعه كشور,/Users/rohamhosseini/Documents/scraper simple/laws_clean/Aeen-Nameh/افزايش__عناوين__درآمدهاي__به__شرح__جدول__...__ماده__79_قانون__برنامه__سوم__توسعه_كشور_5293037398822642078.txt
b0b1cc6cb89b,moderate,taxation,"Directive under Article 134 of 5th plan, tied to tax exemption provisions.",2012,دستورالعمل تبصره  2   ماده  134   قانون برنامه پنجم توسعه جمهوري اسلامي ايران,/Users/rohamhosseini/Documents/scraper simple/laws_clean/Aeen-Nameh/دستورالعمل_تبصره__2___ماده__134___قانون_برنامه_پنجم_توسعه_جمهوري_اسلامي_ايران_8842769083351967759.txt
